film,sort_type,review
The Butterfly Effect,highest,"Filmaaaço. Muito confuso no início, mas conforme o andar das cenas você vai entendendo.Retrataram muito bem o conceito da teoria do caos.Além do mais, minha cabeça explodiu quando percebi que o motivo de todas as voltas dele para tentar ter um futuro melhor sempre foi ela. Kayleigh Miller.Mas ainda assim me pergunto: que fim levou o pai dele? Ainda internado? Nunca esteve? Recebeu alta?"
The Butterfly Effect,highest,"“take what you need, and be on you wayand stop crying your heart out”Sempre assisti “The Butterfly Effect” e ficava agoniado pensando em como eles estavam tão perto de ficarem juntos. Achava um enorme egoísmo eles não tentarem de novo e viverem aquele amor que os prendia em todas as vidas. Mas, com o tempo, entendi que era complicado demais continuar presos em um ciclo de sofrimento.Às vezes, o destino reserva caminhos individuais justamente para que duas pessoas possam se curar — rompendo de vez, o loop de dor, mesmo que no fundo se amem."
The Butterfly Effect,highest,É um final pior que o outro pqp
The Butterfly Effect,highest,"Letterboxd is an independent service created by a small team, and we rely mostly on the support of our members to maintain our site and apps. Please consider upgrading to aPro account—for less than a couple bucks a month, you’ll get cool additional features like all-time and annual stats pages (example), the ability to select (and filter by) your favorite streaming services, and no ads!"
The Butterfly Effect,highest,"sabes, si era tan maravillosa ¿Por qué no me llamaste?¿Por qué me dejaste aquí sufriendo?"
The Butterfly Effect,highest,"Perfeito, é um daqueles filmes que você nunca mais vai esquecer o efeito que ele deixou no seu cérebro."
Sicario,lowest,"Carajo, el sonido se fue de sabático.Hubiera sido buena verla en un viaje interprovincial.Nunca dijeron mamahuevo"
Sicario,lowest,"No es la cosa mas impredecible del mundo en cuanto a historia pero es una de las más solidas del género.Las actuaciones no son muy buenas, pero se recompensa con una dirección muy interesante y cruda con momentos bastante sutiles que es raro en el cine latinoamericano , y un guión muy bien llevado.La música tan llena de terror hace muchas escenas super tensas y claustrofobicas.Ojalá poder ser positivo y decir que esta realidad se quedó en los 90, pero las cosas no son así.También el actor que hace de Jairo es super atractivo bro"
Sicario,lowest,"Gledys Ibarra, no es tu culpa, una estrella es por el potencial que tenía la trama y la otra estrella es por ti reina <3(En serio es lo único que se salva en esta película. Tiene a una de las mejores actrices venezolanas, de las que hacían buen cine antes de pasarse a las telenovelas de Venevisión) Pero coño, fue muy decepcionante ver esto.Empezando por el peor de sus horrores: hacer un casting de venezolanos, grabar en Caracas…"
Sicario,lowest,Esos tiros me van a doler menos que la vida
Sicario,lowest,Charlotte Hornets super fan Jairo
Sicario,lowest,"Se supone que se ambienta en Colombia, pero todo es muy venezolano. No es mala, solo sentí que es algo pretenciosa y muy rústica.Las escenas sexuales estaban demás también."
Sicario,lowest,No pero como así que en Medellín hablan Veneco ?
Sicario,lowest,I couldn't stand that Venezuelan accent
Sicario,lowest,"Cold…cold kicks as well…air max forces, huarache OG CW and Jordan 7 cardinals."
Sicario,lowest,Interesante. El personaje vive y muere en su ley.
Sicario,lowest,"“un intercambio inútil, Jairo. Una casa por un hijo.” 🩸"
Sicario,lowest,La violencia como cotidianidad en los barrios de Latinoamérica.
Sicario,lowest,shooters from medellin in jordan’s and corrosion of conformity shirts
Sicario,lowest,"Las malas actuaciones y el tema del acento distraen un montón.Btw, ese mix de ñeros y punkos está muy out of place, pero me hizo reír.Overall es mala, pero no terrible"
Sicario,lowest,the random ass punk show fight was bomb
Sicario,highest,"Good rags to riches crime flick, but lacking some of the flourishes I felt it needed to make it great. It got boring at times and dragged on a little, especially w everything being so realistically action based. That being said, the set design was solid."
Sicario,highest,Demasiado entretenida Dios mío JAJSJAJSJS es d esas películas que son tan malas que dan risa AJSJAJSJAJS.Muy buena c los juro JAJSJAHSJAHSJ.
Sicario,highest,"I loved this one just as much as the more famous Sicario (same thing happened with the two different movies that happen to be titled Moonlight). For me, the plight of the main protagonist captured my attention immediately and I was wholly enthralled by everything about him and what he goes through. Amazing stuff."
Sicario,highest,interesante q transcurre en medallo pero hablan en idioma chamo. Igualmente buena película
Sicario,highest,"Every country makes movies, however not every country has many movies that are popular or accessible worldwide, and among them are the films made in south American countries, with the exception of stuff like Brazil’s “City of god” or Colombia’s “The embrace of the serpent”, South American cinema tends to massively overlooked and many people aren’t giving them the attention they deserve, which is a real shame, because south America has made lots of great films, and if you dive…"
Sicario,highest,"Cuando busqué críticas de esta película, leí una por encima que tenía una palabra clave para describir esta película: documental. Sicario no parece algo demasiado dramático, por supuesto que hay drama aquí, pero muchos escenarios pueden ser reales. La manera en que muestran cómo Jairo se desarolla en un ambiente nauseabundo y es influenciado me fascina.No es un guion de otro mundo, su historia puede ser predecible, su encanto es que no parece una película hecha para entretener o…"
Sicario,highest,Cine sobre un tema social muy delicado de esos que nadie quiere comentar pero todos saben de su existencia. La cruda realidad latinoamericana
Sicario,highest,mi papá dice q esta película le pasa el huevo por la cara a ciudad de dios
Sicario,highest,situación de todo latinoamerica.
Sicario,highest,"Me parece lógica la decisión de hacer que la historia transcurra en Medellín, por la época en la que la produjeron, pero me parece que se podría haber adaptado a la realidad venezolana ...Es decir, fuera de la disonancia cognitiva del acento, afecta la percepción sobre las actuaciones, aunque dignisima Gledys Ibarra, es un peliculonAquí, creyendome mejor persona porque quiero ver cine venezolano y encontré un montón de películas en el Magis"
Sicario,highest,"Great movie, action packed definitely my favourite"
Sicario,highest,"This movie is loosely based on the life of John Jairo Arias Tascon, also known as Pinina, Pablo Escobar's top hitman.He was directly responsible for ordering the assassinations of Colombian Minister of Justice Rodrigo Lara ( Ivan Dario Guisado Alvarez was the shooter on the back of the motorcycle ) and presidential candidate Luis Carlos Galan and the bombing of the Avianca airplane together with Dandeny Munoz Mosquera also known as La Quica.After serving 23 years in prison,…"
Sicario,highest,Hay que hablar del gol que se hace René Higuita
Sicario,highest,Me ha cambiado la maldita vida.
Sicario,highest,"Un icono, maldita leyendaLo marcada que estan varias imágenes desde mi infancia. ME HAN CORROMPIDO LOS FOTOGRAMAS"
The Hangover,lowest,"The Hangoveris a sad joke. It is pathetic, a disgrace, and a failure in every aspect imaginable. CongratulationsAmerican Beauty,you’re now tied with another film."
The Hangover,lowest,وين الكوميديا اللي اشغلوتنا فيها؟؟؟؟؟؟؟
The Hangover,lowest,I hope no one ever knows how I actually feel about this movie
The Hangover,lowest,"Mesdames et messieurs cette daube raciste , sexiste et homophobe vous a été offert par le """"""""""génie"""""""""" qui vous a offert Joker"
The Hangover,lowest,"Call the police, this is a crime to society (but I as well would like to be unavailable next weekend because The Jonas Brothers are in town)"
The Hangover,lowest,Dont think I even laughed once.
The Hangover,lowest,Un film qui te donne envie de boire… pour oublier que tu l’as regardé.
The Hangover,lowest,"se me olvidó reseñarla x3de las primeras películas que ví en el año, la verdad solo muy pocas escenas me hicieron reír, definitivamente no soy su público objetivo.lo único que me gustó de la experiencia de verla fue tener la televisión en el cuarto mientras me comía unas Takis con mucho chile."
The Hangover,lowest,No quiero ser una de esas personas poco divertidas pero esta película no es para nada graciosa 🙃
The Hangover,lowest,max made me watch this and i fell asleep
The Hangover,lowest,Der schlechteste Film den ich seit langem gesehen habe
The Hangover,lowest,film noch langweiliger als dune
The Hangover,lowest,"Incredibly unenjoyable. This might be one of my least favorite movies I've ever seen. The actors have absolutely no chemistry and every joke amounts to some unfunny one-liner. I don't even think I would have liked it if I had seen it as a teenager when it came out. Mike Epps randomly showing up at the very end was kind of cool, but at that point I had already suffered through this unfunny mess and just couldn't wait for it to end."
The Hangover,lowest,if I hear someone say they liked it I will not take their opinion into consideration ever again
The Hangover,lowest,"Letterboxd is an independent service created by a small team, and we rely mostly on the support of our members to maintain our site and apps. Please consider upgrading to aPro account—for less than a couple bucks a month, you’ll get cool additional features like all-time and annual stats pages (example), the ability to select (and filter by) your favorite streaming services, and no ads!"
The Hangover,highest,"that movie was so ridiculously funny and was set up so well, the acting was great and i love that the first scene is how it all kinda ended up"
The Hangover,highest,"Letterboxd is an independent service created by a small team, and we rely mostly on the support of our members to maintain our site and apps. Please consider upgrading to aPro account—for less than a couple bucks a month, you’ll get cool additional features like all-time and annual stats pages (example), the ability to select (and filter by) your favorite streaming services, and no ads!"
The Hangover,highest,"Yeah it reached its purpose and I like it.The story is laughable in a good way and so many gags are working in between. Also the characters are funny and I enjoy that they slowly realizing what they are doing. Lastly, the editing and pacing is good. I have never feel bored in my watching. Overall a good, hilarious and entertaining movie.388/400"
The Hangover,highest,"Muito engraçado, resenha americana"
The Hangover,highest,Bradley Cooper is a gift from god
The Hangover,highest,phil stealing money from kids to go to vegas is the realest thing ever
The Hangover,highest,if jude law had a cameo this would have won an oscar
The Hangover,highest,Melhor comédia do século 21!#TeamBarman
The Hangover,highest,"if your first language is Spanish I highly recommend watching this in Spanish, laughted out loud, forgot how good this movie was"
The Hangover,highest,This is how the hungover debrief with the girls feels
The Hangover,highest,Everyone needs a friend like Alan . I hope everyone finds a friend like him 💀
The Hangover,highest,Love this movie so much would highly recommended to anyone I feel like this is one of those movies everyone could laugh with.
The Hangover,highest,Best film in the world. I love it
The Hangover,highest,Arguably a top 5 comedy. Undeniably a top 10 comedy.
The Hangover,highest,"i love comedy movie and i gotta say this has got to be one of the greatest comedy of all time, personally my favourite comedy"
Mission: Impossible - Fallout,lowest,Absolutely worst most trash action movie I've ever seen in my life
Mission: Impossible - Fallout,lowest,Like at this point they should change the name to mission possible
Mission: Impossible - Fallout,lowest,hated this we only watched it for Henry Cavill
Mission: Impossible - Fallout,lowest,"Letterboxd is an independent service created by a small team, and we rely mostly on the support of our members to maintain our site and apps. Please consider upgrading to aPro account—for less than a couple bucks a month, you’ll get cool additional features like all-time and annual stats pages (example), the ability to select (and filter by) your favorite streaming services, and no ads!"
Mission: Impossible - Fallout,lowest,theatre messed up and showed the first 15 mins of this movie instead of Oppenheimer and looks like bad and i didn't like
Mission: Impossible - Fallout,lowest,The first 40 minutes were awful. That is all I know. I should have bailed out much sooner but the reputation made me think I had to give it “just one more scene” a few times too many.
Mission: Impossible - Fallout,lowest,you guys are all on drugs what kind of dollar store version of Bourne is this
Mission: Impossible - Fallout,lowest,no wtv that animation was has ruined this movie permanently
Mission: Impossible - Fallout,lowest,wait wtf was that review video😭 ok yea they're really good at this
Mission: Impossible - Fallout,lowest,"Okay apparently Dead Reckoning is an improvement in comparison to that direct imperialist propaganda, at least they moved on to a completely fantastic sci fi villain (still with imperialistic flavor, cause of course it's Russians who invented evil AI, Russia is famously a technological center of the world absolutely capable to do that/s. It really made me think that China, as another ""geopolitical enemy"" of the US but far more advanced, could be much more suitable for that role, but…"
Mission: Impossible - Fallout,lowest,Bu filmin adının mission impossible failout olarak değiştirilmesi için petition başlatıyorum..
Mission: Impossible - Fallout,lowest,"que filme RUIM o pior de todos, a única parte q eu gostei foi quando eles enganaram o personagem do Henry Cavill mas daí não deu nem 5 segundos e cagaram toda a história de nvo mds q filme péssimo e cheio q furos, tom cruise vc já fez melhores"
Mission: Impossible - Fallout,lowest,"MISSION: IMPOSSIBLE to care!Stoked to see they keep bringing back Ving ""Ima get me anotha plate"" Rhames.There are a few rules all these franchise entities follow. One of which is showing the masks and voice changing strip that IMF use to gather information or enact quasi-espionage. This movie is metaphorically a rubber mask but it's a mask of some microscopic balls and huge cartoonish floppy cock.Cavil rules."
Mission: Impossible - Fallout,lowest,سبب تقيمي للفيلم بهذا الشكل الغبنة والاستهطاف اللي صار باخر الفيلم مطاردة الهليكوبترات اللي اخذت وقت طويل والمشهد الاخير صدفة تعطيل القنبلة بوقت واحد ، اوكي ابحث عن الاثارة بس لا تستهطفني بهالخرابيط. اخراج الفيلم كان خارق صراحةً لكن كان فيلم مخيب بالخرافات اللي صارت.
Mission: Impossible - Fallout,lowest,"i LOVE henry cavill, but this movie started my hatred of tom cruise"
Mission: Impossible - Fallout,highest,"Every scene in this movie is top 2 or 3 in the whole franchise, running scene, car chases, climax, crazy off the wall stunt. You name it, this movie is the best at what it does."
Mission: Impossible - Fallout,highest,What a beautiful action movie this is what a spy movie should be bro
Mission: Impossible - Fallout,highest,The arm reloads were an awakening
Mission: Impossible - Fallout,highest,Movie goes so incredibly hard it’s actually insane
Mission: Impossible - Fallout,highest,DO NOT watch mission impossible FRIED you WILL have the TIME OF YOUR LIFE
Mission: Impossible - Fallout,highest,"I’ve seen this countless times, and the last 20 minutes still feel like the most heart attack inducing thrill ride moments of cinema that I’ve ever experienced.Falloutis right up there withFury Roadas the best of action filmmaking in the 2010s.AND YOU KNOW I HAVE TO MENTION HENRY CAVILL WHO IS THE MALE EMBODIMENT OF SEX APPEAL IN THIS MOVIE."
Mission: Impossible - Fallout,highest,"This might have been the best action film since Mad Max: Fury Road. Only that MI6 manages to have a riveting plot with fantastic twists and turns aswell. The score, the setpieces, the stunts, the characters... bravo. Tom Cruise would die for movies and it shows. Say what you want about that man but I respect his passion for the craft.This is the last MI movie that I have seen, Dead Reckoning Part 1 will be new to me, but as of right now this is the pinnacle of the franchise for me."
Mission: Impossible - Fallout,highest,so could a mountain goat get to the detonator faster?
Mission: Impossible - Fallout,highest,"I think out of all the Mission Impossible movies, Fallout is my favorite. Also, I really like how they cast Henry Cavill as a villain in this one. It was a good move. Henry and Tom played off each other really well. my man Henry gets to play more villains in the future because he really fits the role."
Mission: Impossible - Fallout,highest,One of the top 5 action films of all time. Period. This remains one of the most thrilling theater experiences I have yet to enjoy (as of now being age 33) in my life. This is absolutely incredible and one of a kind modern filmmaking
Mission: Impossible - Fallout,highest,You could tell me tom cruise learned how to fly a helicopter for this movie and I would believe you without a second of doubt
Mission: Impossible - Fallout,highest,CINE PAPÁ CINE CLUB ATLETICO ETHAN HUNT
Mission: Impossible - Fallout,highest,"100/100La mejor película de acción que he visto, o más bien con este estilo de agentes, gobierno, CIA, etc...Está es la primera película de la saga que veo, si, inicie por la 6, eso hizo que no entendiera varias cosas pero igual la película se disfruta demasiado y también hizo que me quiera ver toda la saga, porque yo solo iba a ver está y la de 2023 para poder ver la que sale este añoLa acción es increíble, las coreografías son un deleite y me quedo loco con la escena de Tom Cruise guindado del helicptero porque tengo entendido que es real"
Mission: Impossible - Fallout,highest,"One of the greatest action films,Mission: Impossible - Falloutdeploys an arsenal of insane stunts and heart that is almost impossible to top."
Mission: Impossible - Fallout,highest,"Can’t say much I haven’t already said. But what continues to wow me every time I watch this movie is that it just flows like water, one set piece effortlessly into the next. You could say any one of the action set pieces is the best and I wouldn’t be able to disagree, they’re all just that damn good."
The Game,lowest,"Did they really end the movie by saying ""it was all a joke""?"
The Game,lowest,"Letterboxd is an independent service created by a small team, and we rely mostly on the support of our members to maintain our site and apps. Please consider upgrading to aPro account—for less than a couple bucks a month, you’ll get cool additional features like all-time and annual stats pages (example), the ability to select (and filter by) your favorite streaming services, and no ads!"
The Game,lowest,4/100Nicholas:“[leveling gun at carjacker] I am extremely fragile right now.”THE GAME...YOU JUST LOSTThis movie was myInception. What the fuck even happened in this? This might just be the worst and most confusing movie I’ve ever seenThe Game Trailer
The Game,lowest,Hospitals should consider using this with people allergic to sedatives the way it's guaranteed to have you fall asleep
The Game,lowest,Ho trovato questo film noioso e ne ho abbandonata la visione per questo 1/10
The Game,lowest,"Dalej alien 4 gorszy, ale ten film również ohydny"
The Game,lowest,La preuve flagrante que même un aussi bon réalisateur que Fincher peut parfois faire une grosse bouse!!!Juste… À chier…On pourrait faire ce t shirt dans la vieI survive to Watch the gameAnd i deserve that loosy t shirt…
The Game,lowest,Watched it for free but I want a refund.Terrible movie. Ridiculously bad. This is what the Minecraft movie would like to be. This is peak trash holy crap.Probably the favorite movie of a 17 year old skinhead.That was one of the twists of all time.Greatest waist of time & Human Resources.Holy crap this was badThe only way to get a man to reflect
The Game,lowest,The ending ruined theENTIREmovie for me.
The Game,lowest,Adding piano music doesn’t mean the scene is spooky or suspicious. I also love when party guests SAW a door down to get to the party. Fucking stupid
The Game,lowest,"Letterboxd is an independent service created by a small team, and we rely mostly on the support of our members to maintain our site and apps. Please consider upgrading to aPro account—for less than a couple bucks a month, you’ll get cool additional features like all-time and annual stats pages (example), the ability to select (and filter by) your favorite streaming services, and no ads!"
The Game,lowest,"I stopped watching several times because it was boring, so I probably didnt understand much since the breaks were quite longsorry ;d"
The Game,lowest,david fincher kinda botched this one sorry
The Game,lowest,I think I hate this more than anything I’ve seen in years?
The Game,lowest,STUPID PEA BRAIN MOVIE FOR IDIOTS
The Game,highest,Quien no la haya visto tiene que verla
The Game,highest,J’ai beaucoup aimé je suis tombé dessus par hasard super scénario vraiment !
The Game,highest,"My brain just got purple nurpled for 2 hours straight, and you think it would get used to the twists after 30 minutes and then BAM another one. This movie reminds me of Vanilla Sky in that you never know when you are in the game or not. Now I will constantly contemplate if I’m playing the game. I can’t believe it took me 22 years to find this MASTERPIECE. This is Cinema."
The Game,highest,Stopping my goat from becoming washed
The Game,highest,"La película más infravalorada de Fincher.Es fabulosa, los giros y la ambientación.Michael Douglas se luce por completo."
The Game,highest,...everythingexceptgoing to therapy
The Game,highest,En välgjord och spännande actionfylld film. Intrigen innehåller många mardrömslika vändningar. Sett filmen tre gånger och blev överraskad hur bra den är trots att jag egentligen visste vad som skulle hända. En av Michael Douglas absolut bästa roller.
The Game,highest,"Letterboxd is an independent service created by a small team, and we rely mostly on the support of our members to maintain our site and apps. Please consider upgrading to aPro account—for less than a couple bucks a month, you’ll get cool additional features like all-time and annual stats pages (example), the ability to select (and filter by) your favorite streaming services, and no ads!"
The Game,highest,"WHAT IS GOING ON ?????istg if someone do this to me I WOULD CRY AND LOSING MY MINDi love the corporate vibes going on here, especially the black tiles bathroomsuch a cool but silly movie, i didnt expect it at alldefinitely gonna rewatch this movie!"
The Game,highest,sooo good i was on the edge of my SEAT the whole time it was so cool!! the ending when it was all a game still and his brother wasn’t even dead dude my jaw was dropped.
The Game,highest,"Si ce n'est déjà le cas, ce film est destiné à devenir culte.A revoir, le film perd de son effet de surprise, mais je ne peux changer sa note, je me rappelle du choc lors de sa découverte."
The Game,highest,thank youthe game (1997)for inspiring thesuccessionintro !!!one of the best viewing experiences of my life ngl
The Game,highest,FORGOT HOW AMAZING THIS MOVIE IS HOLY SHIT
The Game,highest,"ياخي هاذا جنون فعلا اول ساعه من الفلم خذيت قرار في بالي ان العمل بياخذ اربع نجوم او ثلاث حتى لاكن ما ادركت اني بخلصه وبعطيه خمس نجوم ويستحقها وتالله ما ادري ""ديفيد"" مخرج مجنون بشكل ولا تاريخي شي شي لايوصف العمل يخليك تفكر افكار واجد ويوم تخلص الفلم تقول لنفسك انا وش خلصت توي من قوة الجنونيارجل ؟؟؟فعلا العمل كنت بحطه في المفضله لاكن قلت لنفسي هو تاريخي فعلا لاكن احس صعب اني احطه في المفضله كان في امور وثغرات مخفيه واجد لاكن بعيدا يستحق خمس نجوم بدون مجامله حتى ."
The Game,highest,"Letterboxd is an independent service created by a small team, and we rely mostly on the support of our members to maintain our site and apps. Please consider upgrading to aPro account—for less than a couple bucks a month, you’ll get cool additional features like all-time and annual stats pages (example), the ability to select (and filter by) your favorite streaming services, and no ads!"
Toy Story 4,lowest,"EU ACABEI DE LEMBRAR QUE EU ASSISTI ESSA MERDA DESSE FILME EM 2019 NO CINEMA E ME SUBIU UMA RAIVA DO CACETE TÃO GRANDE NESSE EXATO MOMENTO QUE EU PRECISEI VIR AQUI, WOODY ESCUTA BEM OQUE EU VOU TE DIZER AQUI SEU FILHO DUMA PUTA AMALDIÇOADO, SE EU TE PEGO NA RUA TU TA FUDIDO DESGRAÇADO, EU QUERO VER A NOTÍCIA DE QUE O TEU CORPO FOI DESOVADO NO CIDADE ALERTA AINDA HOJE"
Toy Story 4,lowest,I loved toy story as a kid. This movie was disappointing.
