film,review
The Zone of Interest,"Letterboxd is an independent service created by a small team, and we rely mostly on the support of our members to maintain our site and apps. Please consider upgrading to aPro account—for less than a couple bucks a month, you’ll get cool additional features like all-time and annual stats pages (example), the ability to select (and filter by) your favorite streaming services, and no ads!"
The Zone of Interest,"Letterboxd is an independent service created by a small team, and we rely mostly on the support of our members to maintain our site and apps. Please consider upgrading to aPro account—for less than a couple bucks a month, you’ll get cool additional features like all-time and annual stats pages (example), the ability to select (and filter by) your favorite streaming services, and no ads!"
The Zone of Interest,interesting cinematography but plotless tbh
The Zone of Interest,Absolutely haunting but important to watch
Moneyball,The metaphor at the end of the movie is so genius and a good way to finish telling the underlying story of Beane’s battle with his thoughts.
Moneyball,"""Billy, this is Chad Bradford. He's a relief pitcher. He's one of the most undervalued players in baseball. His defect is that he throws funny…”Gets me going!One of my favorite comfort movies."
Moneyball,"Letterboxd is an independent service created by a small team, and we rely mostly on the support of our members to maintain our site and apps. Please consider upgrading to aPro account—for less than a couple bucks a month, you’ll get cool additional features like all-time and annual stats pages (example), the ability to select (and filter by) your favorite streaming services, and no ads!"
Moneyball,That felt like it made for much better viewing that in was supposed to
Moneyball,"Also blendet man einmal aus, dass bei diesem extrem durchkommerzialisierten Sport Baseball, hier zwischendrin etwas zu sehr der Pathos angerührt wird, dann bietetMoneyballdem Publikum, einen rundum gelungen Sportfilm, bei dem man zum Glück keine Ahnung davon haben muss, wie denn dieser Sport überhaupt funktioniert.Brad Pitt und Jonah Hill, als General Manager und Analyst, begleiten wir überwiegend abseits des Spielfeldes. Die Spieler selbst sind Randfiguren und absolut austauschbar. Hier steht das System und die Philosophie, wie man einen…"
Moneyball,Still have no idea why people watch baseball but it was pretty cool nonetheless.
Moneyball,Brad Pitt’s best performance. One of my favorite sports movies. Immensely entertaining.
Moneyball,Kinda wild to think that they Thought they gut feeling was better than maths and stats lol
Moneyball,"“We lost”“It’s only been a few days. Give yourself some time to get over it”“Man I don’t get over these things. Ever.”Same Billy Beane, same……On another note, very good movie. I’ll watch 50 baseball movies before I’ll watch one full baseball game."
Moneyball,EVERY TIME. Oh my gosh this movie is the most heartwarming story every and I watched on a plane this time.
Moneyball,"Wish this movie would've been confident enough in itself to stay focused on what's interesting here: the GM's career, his evolving strategy, his relationship with the team, the tensions he holds between data science + superstition, the little weirdo Jonah Hill plays, It really didn't need all the extra fluff about his past and his family. Brad Pitt brings so much to this - it's just a joy watching him as this character."
Moneyball,"Billy is still trying to win the last game of the season.What I love about this movie is a naive marxist teenager could probably put on their “thinking cap” and derive that this movie is some class conscious critique of the billionaire thing. Or a cautionary tale of the digital revolution. But no, it’s literally just about baseball.“How can you not be romantic about baseball” “It’s a metaphor”“I know it’s a metaphor”Except it’s not. He doesn’t…"
Moneyball,A great film for stats nerds like me
Moneyball,watched like 1 game of baseball ever but how can you not be romantic about it.
Moneyball,How can you not be romantic about baseball. Plus the daughter’s song is a banger. Great film
Moneyball,"Mei Lu put this on last night, and though I’ve probably seen this in its entirety around 5-10 times, I still sat there and watched it through.Loved the Zaillian parts of the script. The Sorkin rewrites are quite obvious and are, to no surprise, very Sorkin-y. Danna’s score still hits and the general look and pace of everything is still captivating and retain that timeless quality that makes it so rewatch-ableNever recognized scumbag Activision CEO Bobby Kotick and Spike Jonze were in this too, so that was a surprising aspect of this rewatch."
Moneyball,"Great acting, good insight to realism of the behind the scenes in sport, a bit boring at certain stages, but overall a very good watch"
Moneyball,"Letterboxd is an independent service created by a small team, and we rely mostly on the support of our members to maintain our site and apps. Please consider upgrading to aPro account—for less than a couple bucks a month, you’ll get cool additional features like all-time and annual stats pages (example), the ability to select (and filter by) your favorite streaming services, and no ads!"
Moneyball,"this will be done in the nba in the future using the LEBRON stat, first gm to do that will end up bring the oppenheimer of the league"
Moneyball,The perfect movie. Never seen baseball or care about it but I love this film
Moneyball,they needed to kiss after that 20th win
Moneyball,Fucking spectacularI can’t believe they made baseball and statistics this interesting
Moneyball,I fucking live for nerdy sport movies
Moneyball,Too bad it’s not set in Sacramento
Moneyball,"5 star movie, -1 for being horribly inaccurate"
The Last of the Mohicans,"This was discussed on the most recent episode of the Video Archives podcast, which got me intrigued to see this. I’ve never seen any adaptation of this material before. This is the 1936 version, starring Randolph Scott as Hawkeye.This film has everything: fully realized characters, who I was totally invested in, several competing factions, all with their reasons, a great depiction (both positively and negatively) of military codes of honor and duty and lots and lots of action."
The Last of the Mohicans,"If I didn't fell in love with the Mann version years ago, this could be my favourite ""the last of the mohicans"" picture. They made a bunch of them since the silent era. This one, class 1936, holds the test of time, except for the deaths by firearm that are kind of silly, but having say that what a gorgeous film that Seitz pull out of this ever green story. Randalph Scott as Hawkeye gives han solo vibes to his…"
The Last of the Mohicans,Watched due to the Video Archives Podcast.
The Last of the Mohicans,"Although not the first on-screen adaptation of James Fenimore Cooper's iconic 1826 novel, its clear that many of the future tellings of this tale owe a great deal to this George B. Seitz work, which features a younger Randolph Scott as the central Hawkeye, a scout who is tasked with escorting two daughters of Colonel Monroe safely through the brutal French and Native American War.A leaner, more adventurous take on the story than many of the other cinematic adaptions,…"
The Last of the Mohicans,"Yes, I listened to Tarantinos podcast where he gushes about this movie but I was extremely skeptical.I also have not seen the Michael Mann version yet, but this was quite good!Worse part was watching it on plex, horrendous commercials completely took me out of it.Also Randolph Scotts hair style is so bizarre"
The Last of the Mohicans,"Randolph Scott isn't Daniel Day-Lewis, but he is still Randolph Scott. The man's endlessly watchable. The film felt a lot longer than the runtime suggested. It's rather slow and flat in its delivery way more than it needs to be."
The Last of the Mohicans,"Yes I realize I rated this higher than the Mann version, and yes it’s not better, but I need to rewatch it first."
The Last of the Mohicans,It’s so violent and it moves so fast. However if you've seen the Michael Manm version you will constantly be comparing it. Randolph Scott is pretty good but he’s dressed like Davy Crocket.
The Last of the Mohicans,this is marginally better than the 1992 version like that one was just so bad
The Last of the Mohicans,"Sequence perang nya nice, sama ada adegan loncat bunuh diri dari tebing itu jarang banget di film western yg pernah w tonton jadi lumayan shocking. Ending nya potensial bleak (Hawkeye dibakar sebagai ganti squawk bebas) tapi malah jadi payah 🙄 kayak momen nya udah di bangun bleak lah ending nya digampangin gitu, mood rusak banget kawan, padahal bisa jadi film romance tragedy aja. Terus apa yg terjadi dengan emosi bapak yg anak dan kekasihnya yg ikutan loncat tebing itu, halach ga di up sama writer nya payah emang. Kayak target filmnya tuh harus dibikin balance"
The Last of the Mohicans,"I found director George Seitz and editor Harry Marker continually undercutting what few good scenes there are, the Fort Henry attack, the dramatic cliff deaths,Duncan‘s heroic gambit, old native women mutilatingHawkeyesgenitalia, very frustrating for a film I was trying desperately to lock in to. (Note: all of those happen in the last 30 minutes of the film)Clearly I’m not as taken with this story as others.*Randy Scott’s long wavy hair is sexy asfuck.**Skinny Bruce Cabot asMaguain a Mohawk bald cap, less so."
The Last of the Mohicans,Thanks to the Video Archives Podcast for the recommendation.
The Last of the Mohicans,"Pulpy with lots of action, but white Randolph Scott's Hawkeye leads the charge through fights and chases. The fight choreography is rudimentary, the film maintains a consistent level of energy."
The Last of the Mohicans,"1st Movie in the Video Archives episode where American frontier adventure is definitely a theme.The other two, Northwest Passage and Kit Carson, were both decent as was this version of Last of the Mohicans.I do love the story but the lighting is strange and of course the camera framing is old fashioned and there are several blue-eyed Indians.But it was decent. This is the first Video Archives episode where I do not have a clear favourite.All OK."
The Last of the Mohicans,Will the real Hawkeye please stand up?
The Last of the Mohicans,i didn’t want the mohicans to end.
The Last of the Mohicans,Watching anyone in this films acting as they get shot is pure comedy.
The Last of the Mohicans,could barely hear and racist BOOOOOO
The Last of the Mohicans,"Breezy, if somewhat unremarkable adaptation of the classic novel."
The Last of the Mohicans,"I read Jane Austen’s Persuasion in college, and I don’t remember much, but the protagonist’s father has always stuck with me. A pathetic character who preferred to immerse himself in the past rather than face the reality of his present. Anyway, I’ve been really digging old movies recently for some reason."
The Last of the Mohicans,A relentless entertainment machine.
The Last of the Mohicans,"This pleasantly surprised me. Initially, I had reservations about the casting choices, as the two main actors seemed too similar. However, as the story unfolded, I realized that this was actually a clever decision. The plot captivated me from start to finish, and I was particularly drawn to the breathtaking cliff-top scene, which evoked memories of the classic film ""All Quiet on the Western Front."" While the acting didn't reach extraordinary heights, it still held its own. I couldn't help…"
The Last of the Mohicans,why is there a hundred-fucking-million of these and they all suck ass
The Last of the Mohicans,You can be a he or a she or a squaw.
The Last of the Mohicans,"*insett George bush being notified about 9/11 meme*""Sir theres been another Mohican"""
The Butterfly Effect,4 Different endings are we serious? Of course I watched the DC which was the most sadistic. This rating is based off of that specific ending. May have been better if they had gone with one of the others.
The Butterfly Effect,"No vi una mariposa😪 pero bien, oasis al final"
The Butterfly Effect,"Simplesmente impecável, a trama, a atuação, literalmente como é tratado o efeito borboleta, é um filme que não importa o quando envelheça, permanecerá impecável."
The Butterfly Effect,"Letterboxd is an independent service created by a small team, and we rely mostly on the support of our members to maintain our site and apps. Please consider upgrading to aPro account—for less than a couple bucks a month, you’ll get cool additional features like all-time and annual stats pages (example), the ability to select (and filter by) your favorite streaming services, and no ads!"
The Butterfly Effect,"“Wrong answer, fuckbag. This is the very moment of your reckoning.” I love this so much."
The Butterfly Effect,He did it. He went back in time to the first Thanksgiving. To take Kayleigh off the menu!
The Butterfly Effect,"É realmente muito estranho quando você não espera NADA do filme e ele é MUITO bom!!! A sensação de ter acertado, serioo, já tinha ouvido falar no filme, sempre tive curiosidade pra assistir , porém nunca dei muita bola, daí hj resolvi assistir é nossa, me surpreendi, a trama te envolve do começo ao fim, o frio na barriga por não saber o que causa os apagões e a euforia de descobrir que é o próprio personagem voltando ao passado…"
The Butterfly Effect,"Perfeito, é um daqueles filmes que você nunca mais vai esquecer o efeito que ele deixou no seu cérebro."
The Butterfly Effect,eu tô muito triste c esse final mds que PORRA foi essa
The Butterfly Effect,si estas muy traumado o estudias psicología o terminas preso
The Butterfly Effect,michael kelso in an alternate universe?
The Butterfly Effect,You can't change who people are without destroying who they were.
The Butterfly Effect,"sabes, si era tan maravillosa ¿Por qué no me llamaste?¿Por qué me dejaste aquí sufriendo?"
The Butterfly Effect,"Dulcemente trágica. Los saltos temporales un poco forzados pero tienen buena conexión entre ellos, de las pocas veces que me ha alegrado que una película tenga un final positivo y esperanzador a pesar de las duras decisiones."
The Butterfly Effect,Venia de consumir mucho de Ashton Kurcher como “two and a half men” o “Thats 70 show” y me sorprendió. Me demostró que es mas que un brillante actor de comedia.Pelicula brillante. Thriller sobre las consecuencias de nuestras acciones y como estas hacen que nuestra vida tome un rumbo completamente distinto
The Butterfly Effect,holy????? my friend recommended me to watch this..its a very interesting premise for a movie and it really put into perspective how one changing one thing can have such catastrophic impacts on one's life..... guess thats why its called.. the butterfly... effect.... 😳😳😳also the movie poster is ugly
The Butterfly Effect,The fact he went back and said that to her just to protect her ☹️
The Butterfly Effect,"Sinceramente eu n consegui passar da metade desse filme.Talvez pq ele seja extremamente brutal (pelo menos até a metade) ou pq eu estou extremamente sensível (talvez os dois).Não sei se toda a violência é justificada no resto do filme pra mostrar a tendência à autodestruição e à agressão de pessoas doentes e/ou que se odeiam ou é só algo superficial pra satisfazer algum fetiche do roteirista ou do diretor e que não acrescenta, de fato, algo no enredo.…"
The Butterfly Effect,The Director's Cut is ananti-natalistpropaganda.
The Butterfly Effect,"Esse filme é incrível, mostra exatamente como o efeito borboleta funciona, e as vezes amar é deixar ir, e ainda tem quatro finais diferentes"
The Butterfly Effect,"Bom, o que importa é que ele foi atraente em todas as fases né?"
The Butterfly Effect,ending threw me off so bad 😭 #verysadending #fewjumpscares but actually a pretty good movie
The Butterfly Effect,"What a movie and what an ending. I watched the director's cut and its absolutley traumatizing. interesting story, good acting, banger ending. 4/5"
The Butterfly Effect,"Letterboxd is an independent service created by a small team, and we rely mostly on the support of our members to maintain our site and apps. Please consider upgrading to aPro account—for less than a couple bucks a month, you’ll get cool additional features like all-time and annual stats pages (example), the ability to select (and filter by) your favorite streaming services, and no ads!"
The Butterfly Effect,ella le daba 5 estrellas a todo lpm y bueno está padre kutcher y una idea falopa yo estoy acá para darle 5 estrellas
Sicario,Cine sobre un tema social muy delicado de esos que nadie quiere comentar pero todos saben de su existencia. La cruda realidad latinoamericana
Sicario,"adoro que decidieron no ambientarla en caracas porque ya habían suficientes películas marginándola en la época, nada herrado a lo que era en aquel entonces o en la actualidad. ciertamente “conformarse es la peor forma de morir”"
Sicario,never a happy ending for gangsters 😔
Sicario,"Carajo, el sonido se fue de sabático.Hubiera sido buena verla en un viaje interprovincial.Nunca dijeron mamahuevo"
Sicario,"I loved this one just as much as the more famous Sicario (same thing happened with the two different movies that happen to be titled Moonlight). For me, the plight of the main protagonist captured my attention immediately and I was wholly enthralled by everything about him and what he goes through. Amazing stuff."
Sicario,"really amazing visual pieces, a must-watch for anyone interested in adolescent coming-of-age narratives that embrace the masculine perspective.for young boys who don’t get to know anything else, life is crime - life is sex - life is hard fought.in a lot of ways i think this films does its best to hammer in this isn’t what’s supposed to be admired by young men, but it’s what becomes engrained after tons of exposure and exploitation.the scenes in prison…"
Sicario,interesante q transcurre en medallo pero hablan en idioma chamo. Igualmente buena película
Sicario,el final era muy bueno para ser verdad...
Sicario,"“Dificil es vivir en la miseria, conformarse es la peor forma de vivir”"
Sicario,"Gledys Ibarra, no es tu culpa, una estrella es por el potencial que tenía la trama y la otra estrella es por ti reina <3(En serio es lo único que se salva en esta película. Tiene a una de las mejores actrices venezolanas, de las que hacían buen cine antes de pasarse a las telenovelas de Venevisión) Pero coño, fue muy decepcionante ver esto.Empezando por el peor de sus horrores: hacer un casting de venezolanos, grabar en Caracas…"
Sicario,Me ha cambiado la maldita vida.
Sicario,mi papá dice q esta película le pasa el huevo por la cara a ciudad de dios
Sicario,messy low budget narco drama/action from colombia that somehow grabs your attention throughout
Sicario,"Good rags to riches crime flick, but lacking some of the flourishes I felt it needed to make it great. It got boring at times and dragged on a little, especially w everything being so realistically action based. That being said, the set design was solid."
Sicario,"One of the first films I watched when I started my journey to learn Spanish. Its Raw, violent and has special place in my heart."
Sicario,"Cuando busqué críticas de esta película, leí una por encima que tenía una palabra clave para describir esta película: documental. Sicario no parece algo demasiado dramático, por supuesto que hay drama aquí, pero muchos escenarios pueden ser reales. La manera en que muestran cómo Jairo se desarolla en un ambiente nauseabundo y es influenciado me fascina.No es un guion de otro mundo, su historia puede ser predecible, su encanto es que no parece una película hecha para entretener o…"
Sicario,the random ass punk show fight was bomb
Sicario,"Too much kid bush, but otherwise quite good"
Sicario,"Un icono, maldita leyendaLo marcada que estan varias imágenes desde mi infancia. ME HAN CORROMPIDO LOS FOTOGRAMAS"
Sicario,Naked kissing scene in the ocean
Sicario,"«Es un sacrificio inútil... una casa, a cambio de un hijo».Una experiencia muy bonita verla en HD. Esta en Pluto tv para quien la quiera ver.Una buena película, pero nada más allá. Ningún pretexto más fuerte que los mismos tópicos del cine venezolano que suelen ser mitad y mitad: una de muy buen cine con sus modos y elementos, y otra que se olvida totalmente del lenguaje y se confunde a sí misma con Quna campaña antidrogas.El…"
Sicario,"Whoa this movie took me by surprise. So violent, raw, and gritty. Loved every second. Needs a rewatch"
Sicario,"Cold…cold kicks as well…air max forces, huarache OG CW and Jordan 7 cardinals."
Sicario,"Every country makes movies, however not every country has many movies that are popular or accessible worldwide, and among them are the films made in south American countries, with the exception of stuff like Brazil’s “City of god” or Colombia’s “The embrace of the serpent”, South American cinema tends to massively overlooked and many people aren’t giving them the attention they deserve, which is a real shame, because south America has made lots of great films, and if you dive…"
Sicario,Demasiado entretenida Dios mío JAJSJAJSJS es d esas películas que son tan malas que dan risa AJSJAJSJAJS.Muy buena c los juro JAJSJAHSJAHSJ.
The Hangover,"Watched it three times; high, sober, and drunk yet I never laughed. It’s not that funny. 3/10 movie."
The Hangover,"Je ne serai absolument pas objectif — et ça me va très bien.Pour un film comique,Very Bad Tripest un excellent divertissement. Certes, l’histoire n’est pas révolutionnaire et les mises en scène ne risquent pas de vous éblouir par leur beauté, mais on ne peut nier que ce film est devenu un véritable classique !L’humour, aussi absurde soit-il, fonctionne à merveille, et on prend un vrai plaisir à regarder comment les protagonistes tentent tant bien que mal…"
The Hangover,this is the stupidest film i’ve ever watched
The Hangover,"No se si tengo el humor demasiado roto, pero estuve toda la película cagado de la risa (Alan es mi animal espiritual cawn)."
The Hangover,cant wait for me and my wolfpack's turn for vegas
The Hangover,This is THE comedy movie. Gives you dreams about what a Vegas trip with the fellas would be like. Will never miss.
The Hangover,"Letterboxd is an independent service created by a small team, and we rely mostly on the support of our members to maintain our site and apps. Please consider upgrading to aPro account—for less than a couple bucks a month, you’ll get cool additional features like all-time and annual stats pages (example), the ability to select (and filter by) your favorite streaming services, and no ads!"
The Hangover,"Letterboxd is an independent service created by a small team, and we rely mostly on the support of our members to maintain our site and apps. Please consider upgrading to aPro account—for less than a couple bucks a month, you’ll get cool additional features like all-time and annual stats pages (example), the ability to select (and filter by) your favorite streaming services, and no ads!"
The Hangover,- 2/5- Bradley Cooper prime- Eso me pasó en Valle un día
The Hangover,I fear that I’m the too woke friend.
The Hangover,watched this when i was making mango jam and it still rocks (the jam was phenomenal btw)
The Hangover,Everyone needs a friend like Alan . I hope everyone finds a friend like him 💀
The Hangover,Debatably the funniest movie oat
The Hangover,Really love this movie consistently funny trough out Zach Galifianakis is hilarious as alan every character adds there own quirks to the plot.Very funny writing.
The Hangover,"i love comedy movie and i gotta say this has got to be one of the greatest comedy of all time, personally my favourite comedy"
The Hangover,"Alan Fucking DiesPretty good, really enjoyed most of the jokes and the plot is entertaining enough.Alan is the most annoying character by far and takes away from most of jokes as they just go on too long. Mike Tyson ‘killing him’ was greatBradley Cooper is easily the best character."
The Hangover,"As fantasias do americano médio que se recusa a crescer, the hangover é um retrato muito interessante sobre a capacidade masculina de se humilhar enquanto bêbado. O mais engraçado é o filme se recusar a focar na festa e nos momentos divertidos que os personagens viveram em Las Vegas, ou sequer lembrarem de qualquer momento bom que tiveram — extremamente na contramão dos filmes sobre a fantasia de grandiosidade das festas americanas, como Projeto X — e sim ser uma história inteira sobre reparar os erros cometidos numa noite imprudente e adulterada."
The Hangover,"Letterboxd is an independent service created by a small team, and we rely mostly on the support of our members to maintain our site and apps. Please consider upgrading to aPro account—for less than a couple bucks a month, you’ll get cool additional features like all-time and annual stats pages (example), the ability to select (and filter by) your favorite streaming services, and no ads!"
The Hangover,"Letterboxd is an independent service created by a small team, and we rely mostly on the support of our members to maintain our site and apps. Please consider upgrading to aPro account—for less than a couple bucks a month, you’ll get cool additional features like all-time and annual stats pages (example), the ability to select (and filter by) your favorite streaming services, and no ads!"
