film,sort_type,review
Interstellar,lowest,"Película sobrevalorada, solo a los pendejos les gusta y la idolatran. Mierda, mierda, mierda y hueeeeeeva"
Interstellar,lowest,Anyone who thinks this movie is “deep” or “profound” is the biggest dumbest poser on earth. This movie is long boring and very straight forward. I HATE IT
Interstellar,lowest,chato demais e plot previsível.
Interstellar,lowest,"Letterboxd is an independent service created by a small team, and we rely mostly on the support of our members to maintain our site and apps. Please consider upgrading to aPro account—for less than a couple bucks a month, you’ll get cool additional features like all-time and annual stats pages (example), the ability to select (and filter by) your favorite streaming services, and no ads!"
Interstellar,lowest,"Letterboxd is an independent service created by a small team, and we rely mostly on the support of our members to maintain our site and apps. Please consider upgrading to aPro account—for less than a couple bucks a month, you’ll get cool additional features like all-time and annual stats pages (example), the ability to select (and filter by) your favorite streaming services, and no ads!"
Interstellar,lowest,Just wanted to drop some hate it’s in my blood
Interstellar,lowest,"Most overrated movie of all time. People who enjoy this movie get wet when they hear Matthew mcconnahey say Alright Alright Alrighttt. The plot does not make any sense — love does not actually transcend time and space, explain why my parents got a divorce, then letterboxd??? Also, how is this movie so great when it does not make any sense? The man is unconscious getting sucked into a black hole and some one miracoursly gets out scott free. ALSO,…"
Interstellar,lowest,"Za prijeten spanec je dober, ker se film vlece se dolgo v noc. Drugace ga ne bi priporočal. Vsebinsko je pujspa pepa na visjem nivoju."
Interstellar,lowest,bella merda di film 😁‼️come sprecare quasi 3 ore di vita.
Interstellar,lowest,Found it boring and I couldn’t  finish it
Interstellar,lowest,me encantó la película y hasta lloré (ni es muy complicado) la vdd es que me dio en toda mi mazorca pero está súper linda y creo que es muy mi tipo de película pq es del mensaje de “el amor es la fuerza más poderosa” algo q diría la vdd pero de vdd la amé. QUEDATEEE 😭😭 le doy media estrella pq me la recomendó un tremendo hijo de la re mil putisima que me frienzoneo de una forma muy grosera puto
Interstellar,lowest,i hate this movie with every fibre of my being. I would tell everyone involved to their face how much joy it stole from my life
Interstellar,lowest,"Letterboxd is an independent service created by a small team, and we rely mostly on the support of our members to maintain our site and apps. Please consider upgrading to aPro account—for less than a couple bucks a month, you’ll get cool additional features like all-time and annual stats pages (example), the ability to select (and filter by) your favorite streaming services, and no ads!"
Interstellar,lowest,"Yeah I wasn’t a fan of this one, it’s pacing is horrendous, in fact it’s so horrendous it makes the movie an absolute snooze fest, the planets are about as original as the planets from a Kirby game, a major plot hole and CHRIST is Murph such an insufferable loony nutball bitch"
Interstellar,lowest,really not much story to this movie i’m not sure why christopher nolan is so popular for this
Interstellar,highest,"Letterboxd is an independent service created by a small team, and we rely mostly on the support of our members to maintain our site and apps. Please consider upgrading to aPro account—for less than a couple bucks a month, you’ll get cool additional features like all-time and annual stats pages (example), the ability to select (and filter by) your favorite streaming services, and no ads!"
Interstellar,highest,my life never gonna be the same after watching this masterpiece
Interstellar,highest,scenic cinematographythe acting is immaculatealmost accurate physicsvery good carrying on the plot
Interstellar,highest,One of the bests of all time. Surprising plots unexpectedly emotional
Interstellar,highest,NEVER GETS OLD. will always love space movies.  🫶🏼
Interstellar,highest,One of the best of Nolan’ movies.Noon can combine science and drama with the good story.
Interstellar,highest,I cried cuz this is too damn good.
Interstellar,highest,"perfection, like actual perfection my god"
Interstellar,highest,everyone say THANK YOU christopher nolan I really needed a good cry
Interstellar,highest,"Letterboxd is an independent service created by a small team, and we rely mostly on the support of our members to maintain our site and apps. Please consider upgrading to aPro account—for less than a couple bucks a month, you’ll get cool additional features like all-time and annual stats pages (example), the ability to select (and filter by) your favorite streaming services, and no ads!"
Interstellar,highest,"cry count: 5spectacular, poignant, and bittersweet."
Interstellar,highest,Best movie I’ve ever watched in my life
Interstellar,highest,ขอบคุณตัวเองที่วันนั้นโดดคลาสเพื่อไปดูหนังเรื่องนี้บนจอใหญ่ที่เซ็นลาดถึง Homage ของมันจะไม่ได้ยิ่งใหญ่เทียบเท่าสิ่งที่จอมจักรวาลเคยทำไว้แต่มันเลือกที่หวนกลับมายังสิ่งที่เรียบง่ายและทรงพลังกว่าพลังจักรวาลก็คือความรักและคำมั่นสัญญาที่มันเหนือกาลเวลา จาก Hard Sci-if สู่ความ Overwhelmed ที่ Nolan ถ่ายทอดออกมาได้ยอดเยี่ยมที่สุด
Interstellar,highest,fucking favorite movie I cry every time when watch this film <3333 feel like alone in galaxy
Interstellar,highest,absolutely stunninglove you Nolan
The Dark Knight,lowest,"CHECK THE DATEhonestly, terrible film. it has an unlikable protagonist, gratuitous violence, shines an unflattering (and undeserved) light on corporate America, glamorizes child abuse, and sends a terrible message to children. is this really the kind of movie we want to be showing the nation's youth? there's already so much violence and death in the world. do we really need to be glorifying it on screen?in short, horrible choice for family movie night. anyone who enjoys this ""film"" is a total monster who should be spit on in the streets."
The Dark Knight,lowest,İzlemedim ama Christopher Nolan filmiyse berbattır.
The Dark Knight,lowest,Je comprend pas la hype la team désolé…😔
The Dark Knight,lowest,"Like watching continual 45 second trailers for an action movie. Completely lacking in pace, because the pace is so pointless exhausting."
The Dark Knight,lowest,"que queres que te diga, es un conjunto de momentos sin sentido, un trailer sin fin, no la termino de agarrar"
The Dark Knight,lowest,"Overrated, Overlong, and Overly SeriousThe Dark Knight is one of the most overrated films of all time—an unnecessarily long, self-important crime drama that just happens to have Batman in it. Christopher Nolan drains all the fun out of a superhero movie, replacing it with endless monologues, dull cinematography, and an obsession with being “gritty” to the point of exhaustion.Christian Bale’s Batman is a joke—his growly, unintentionally hilarious voice makes every serious moment feel like a parody. The action…"
The Dark Knight,lowest,"Лучший... пример того как можно обмануть зрителя, внушив ему что перед ним гениальное кино, потому что в нем есть якобы сильный конфликт с якобы сильной развязкой, который покрывает всю дешевизну фильма написанного и снятого на отвали, а еще цитаты ЖОКЕРА которые якобы для особо умных, хотя на деле просто мем, за извращение образа Джокера нигилиста их мало на мотоцикле Бэтмена сбить полным газом, братья Ноланы в этом случае просто скамеры, которые просто залутали бабок на массовом... как же это слово…"
The Dark Knight,lowest,"Love Heath Ledger but this was so, so, so boring. Dunno if it would’ve been better if I was 10, but I stopped watching 3/4 through because it’s too long."
The Dark Knight,lowest,"“The Dark Knight? More Like The Dull Knight”Rating: 0/5 StarsI tried watching The Dark Knight because everyone said it was “the greatest superhero movie of all time.” Well, guess what? THEY LIED. This movie is an overhyped mess. Allow me to explain:1. Where’s the light? The movie is literally so dark, I couldn’t see half of what was happening. Who turned off the brightness? Did Gotham not pay their electricity bill? I had to turn my TV…"
The Dark Knight,lowest,"Letterboxd is an independent service created by a small team, and we rely mostly on the support of our members to maintain our site and apps. Please consider upgrading to aPro account—for less than a couple bucks a month, you’ll get cool additional features like all-time and annual stats pages (example), the ability to select (and filter by) your favorite streaming services, and no ads!"
The Dark Knight,lowest,Mi pelicula favorita de la vida no tengo nada mas que decir la he visto como 20 veces y nunca me aburro
The Dark Knight,lowest,I wouldn’t fuck any of the villains in this movie
The Dark Knight,lowest,i’m the hero letterboxd deserves 🦇
The Dark Knight,lowest,"Anarky con pintura facial causa estragos en Chicago.Buena y entretenida, pero no es una verdadera película de Batman... Y arruinó al Joker."
The Dark Knight,lowest,"As far as movies and superhero adaptations go, this is how you fumble it up 101. You can feel the pretentiousness of Christopher Nolan's vision as he torments the comic book genre and replaces it with his sob crime drama script that gives little to nothing for Batman to accomplish. The way he punches looks like a martial artist using casts for fists. There is also an obvious lack of CGI in the ""practical"" stunts that creates a practically fake…"
The Dark Knight,highest,"It's not about what I want, it's about what's FAIR!!!"
The Dark Knight,highest,forever one of my favourite films ever. a masterpiece in every way. rip heath ledger you king
The Dark Knight,highest,"Letterboxd is an independent service created by a small team, and we rely mostly on the support of our members to maintain our site and apps. Please consider upgrading to aPro account—for less than a couple bucks a month, you’ll get cool additional features like all-time and annual stats pages (example), the ability to select (and filter by) your favorite streaming services, and no ads!"
The Dark Knight,highest,"when one of the finest directors, a legendary composer, and two lead actors at the top of their game come together to maximize their joint slay. yeah, it doesn’t get any better than this."
The Dark Knight,highest,foi preciso um apagão nacional para eu finalmente decidir ver o dvd disto que comprei no verão do ano passado
The Dark Knight,highest,"Letterboxd is an independent service created by a small team, and we rely mostly on the support of our members to maintain our site and apps. Please consider upgrading to aPro account—for less than a couple bucks a month, you’ll get cool additional features like all-time and annual stats pages (example), the ability to select (and filter by) your favorite streaming services, and no ads!"
The Dark Knight,highest,He’s silent guardian a watchful protector A dark knight
The Dark Knight,highest,"não gosto da dc, mas que filme BOM extremamente BOM"
The Dark Knight,highest,phenomenal. no superhero movies ever come close to this masterpiece.
The Dark Knight,highest,I’d smash majority of the men in this except for harvey EW
The Dark Knight,highest,ฮีท เลทเจอร์ ผู้นำความทรงพลังแห่งโจ๊กเกอร์มาอัดแน่นให้หนังภาคนี้สุดยอด เสียดายแค่เปลี่ยนตัวราเชลมาเป็น แมกกี่ จิลเลนฮอล ประเด็นที่เด่นสุดคือการเป็นฮีโร่ คุณต้องเลือกอะไรบ้าง กางทุกตำราจิตวิทยามาเล่นกันในกนังเรื่องนี้ สนุกครบ จนต้องซ้ำตลอด
The Dark Knight,highest,"Truly a great movie. So well directed and the story is very good, too. The opening sequence is perhaps the best made heist in film history. Not as complex as an Ocean's 11 or Inside Man, but so perfectly executed, right down to the mask reference to The Killing."
The Dark Knight,highest,Literally my fav in this trilogy it’s so amazing that I can’t explain I literally can’t eat for days after I finish it it’s amazing but I kinda miss first lead actress and joker omg amazing he’s deff best joker I literally love the boat scene it’s so warm my  heart I really love human ❤️
The Dark Knight,highest,"Letterboxd is an independent service created by a small team, and we rely mostly on the support of our members to maintain our site and apps. Please consider upgrading to aPro account—for less than a couple bucks a month, you’ll get cool additional features like all-time and annual stats pages (example), the ability to select (and filter by) your favorite streaming services, and no ads!"
The Dark Knight,highest,HANS ZIMMER + CHRISTOPHER NOLAN + CHRISTIAN BALE = THE BEST COMBINATION EVER IN THIS WORLD
Inception,lowest,Parabéns aos envolvidos essa é uma das maiores merdas que já vi
Inception,lowest,"Letterboxd is an independent service created by a small team, and we rely mostly on the support of our members to maintain our site and apps. Please consider upgrading to aPro account—for less than a couple bucks a month, you’ll get cool additional features like all-time and annual stats pages (example), the ability to select (and filter by) your favorite streaming services, and no ads!"
Inception,lowest,"didnt care for the characters, and a waste of a cool idea"
Inception,lowest,bu filmden önce bilim kurgu sevmiyorum sanıyordum anladım ki nefret ediyormuşum
Inception,lowest,"Snooze fest, didn’t finish. Also didn’t really pay attention but it just didn’t pull me in"
Inception,lowest,"Nolan ha dichiarato in un intervista in merito a Inception, di aver preso spunto da Paprika di Satoshi Kon. Diciamo più che ha deciso di girare il live action di Paprika, cambiando per quello che sembra il finale, andando a fare un ode al cinema, ma nemmeno in questo c’è riuscito. Poi una cosa che mi fa girare le palle di Nolan è questa insistenza di non voler usare la CGI, “perché così è più autentico”, egocentrico del cazzo."
Inception,lowest,"So, I sat through whatever the fuck this was and I had one question, does Christopher Nolan hate his wife? Because if I had a nickel for every time he wrote a tragic, suffering, dead wife into a script, I could fund an actually coherent movie. This “movie” tries so hard to be cool and mysterious, but all it really does is make no fucking sense. It’s like Nolan smoked a blunt, wrote down some half-baked “deep” quotes, and then…"
Inception,lowest,"Inception is a two-and-a-half-hour TED Talk on dreams disguised as a heist movie that thinks it's way smarter than it actually is. Nolan piles on layers of exposition like he’s afraid we’ll blink and miss how *deep* it all is, while characters stand around explaining the rules of the dream world like confused tour guides. The emotional core is paper-thin, buried under so much cold, mechanical plotting that even DiCaprio can’t make you care. And don’t even get me started on the spinning top ending—cheap ambiguity pretending to be profound. It’s style over substance in the most exhausting way. 0/10, wake me up when it’s over."
Inception,lowest,Only dead people will find this shit moderately entertaining 👎🏻🗑️
Inception,lowest,The dream within a dream within a dream within a dream is……the third act of a modern James Bond film?
Inception,lowest,"Letterboxd is an independent service created by a small team, and we rely mostly on the support of our members to maintain our site and apps. Please consider upgrading to aPro account—for less than a couple bucks a month, you’ll get cool additional features like all-time and annual stats pages (example), the ability to select (and filter by) your favorite streaming services, and no ads!"
Inception,lowest,Je pourrais faire mieu avec mes mains dans mon cul et une jambe dans deux poubelles
Inception,lowest,não tem absolutamente NADA de interessante nesse filme esdrúxulo
Inception,lowest,Le film paraît très très long car je n’ai rien compris au film. Je déconseille fortement à par si vous voulez passer un mauvais moment.
Inception,lowest,Assisti 5 minutos e dormi. Fim.
Inception,highest,"""in my dreams we're still together"""
Inception,highest,everything in this film screamed masterpiece
Inception,highest,hate to admit it but dicaprio did his big one on this
Inception,highest,"Une masterclass du cinéma, du grand art à tout les niveaux"
Inception,highest,"“couldn’t someone have dreamt of a goddamn beach”☠️dom cobb sure does, man."
Inception,highest,did not expect to love this movie so much and did not expect to see so many people that i liked in it… 10/10 would rewatch. also cillian murphy’s eyes?! good lord.
Inception,highest,An absolute masterpiece from one of the best to ever do it.
Inception,highest,ลูกดิ่ง ลีโอนาโด้ โจรขโมยความฝัน และหารตีความตอนจบแบบเฉพาะตัว
Inception,highest,"Wait, did i just watch this or is it just a dream?"
Inception,highest,"Remains incredibly fun and gripping on the rewatch, especially now you can look into the details more and explore alternative ending meanings. Marion Cotillard performance as Mal really stuck out to me this time. Her ability to play the warm charming and loving wife was obvious but her ability to instantly switch into a cold murdering icy stare uncanny valley style was excellent."
Inception,highest,"The name Christopher Nolan and the concept of'time dilation' has been written in correspondence for over a decade, and this is the genesis of that correlation, Not only was 'Inception' the blueprint of his clock core classics like Interstellar and Tenet, but I believe it was when the notorious director truly hit the mark. Curating a concise visual conveyance of a confusing idea is often a losing battle for movie makers, but here, that's not the case. A dream…"
Inception,highest,Damnnn how will I be able to sleep tonight after watching this????
Inception,highest,Don Cobb steal my mind. Terrific idea about stealing a dream. Great direction acting editing cinematography VFX emotional and its plot and story
Inception,highest,I rewatched Cillian Murphy American accent like 5 times
Inception,highest,Best sci-if movie ever. Even after 10 years I’ll still say this
Lord of War,lowest,"Letterboxd is an independent service created by a small team, and we rely mostly on the support of our members to maintain our site and apps. Please consider upgrading to aPro account—for less than a couple bucks a month, you’ll get cool additional features like all-time and annual stats pages (example), the ability to select (and filter by) your favorite streaming services, and no ads!"
Lord of War,lowest,"Letterboxd is an independent service created by a small team, and we rely mostly on the support of our members to maintain our site and apps. Please consider upgrading to aPro account—for less than a couple bucks a month, you’ll get cool additional features like all-time and annual stats pages (example), the ability to select (and filter by) your favorite streaming services, and no ads!"
Lord of War,lowest,Um dos filmes mais homem branco médio estadunidense que eu já vi. Eu acho que o Jared Leto tá me perseguindo.
Lord of War,lowest,Juan jamás olvidare el dia que me hiciste ver este tremendo ñordaco
Lord of War,lowest,"I recommend highly, very highly that you don't watch this trash.Dull as hellDumb as hellSpend your time dusting the house, cleaning your room, doing the dishes, picking up after your dog, cleaning up your neighbors dog droppings, picking your nose, or taking a nap. Take up a new hobby of staring at the wallpaper looking for hidden codes, anything would be time better spent."
Lord of War,lowest,fell asleep against a hard brick wall while watching
Lord of War,lowest,j'aurais jamais regardé ça toute seule oh qu'est-ce que c'est nul ces américains bandeurs de guerre là
Lord of War,lowest,"La verdad se me hizo inmirable, la sobre-narración constante, el constante hacerse una paja con las armas, osea tenia un mensaje “anti-guerra” pero siento que decia todo lo contrario constantemente, el desarrollo de personajes en inexistentes, no entendes ni como el chabon arranca de un dia para el otro a ser el mejor traficante de armas de la nada misma.La actuación de Jared Leto me dio cringe.Me pareció muy superficial en todo sentido y totalmente olvidable."
Lord of War,lowest,Couldn’t finish it nic cage is shockingly boring and it does NOT hold up. Every character has zero stakes and the glib vibe does not work. Can’t root for anyone including wraith like Ethan hawke.
Lord of War,lowest,"this film have money, this film have jared leto, this film have ethan hawke BUT THIS FILM IS A TRASH"
Lord of War,lowest,What a shit film. I get that it‘s trying to say something good (?) and maybe even trying to cirtique what it shows on a deeper level but at the same time I didn‘t get it because all there is to take away from this is that Nicholas Cage played a rich armsdealer who‘s able to buy himself the woman he wants and then cheats on her. Wtf is the point of this film. Feels like republican gun propaganda.
Lord of War,lowest,I was wondering how much of the movie should be removed in order to make it less ... bad ... I guess a good 50% could be something to start with.Anyway I enjoyed watching it because it reminded me that dialogues actually needs to be written.
Lord of War,lowest,from beginning to end this was fucking terribledaniels ratings will now be questioned for i have lost faith in him
Lord of War,lowest,"It's a piece of shit.I recently watched most of The Purge franchise, which I mocked time and time again for its absolute lack of subtlety and how it holds the audience's hand. I think this movie is less subtle than even the worst The Purge movie.I was gonna rant about this movie for hours but it genuinely doesn't even deserve that. Abysmal storytelling, problematic depiction of Liberia and Sierra Leone, Jared Leto, dreadful voice-over, terrible choice of music,…"
Lord of War,lowest,Every single woman in this movie is depicted as LESS THAN an object. This was a PAINFUL and MISOGYNISTIC plot. Ouch. It was sickening.
Lord of War,highest,One of my favourite Nicolas Cage performances.
Lord of War,highest,"This movies awesome, I’d beat the shit out of that stupid fucking INTERPOL agent, not because he was doing anything wrong, but because I kinda don’t like the way Ethan Hawke goes about it"
Lord of War,highest,"literally the perfect movie for me like i had to force myself to blink its that good at one point i wanted to whip it out and start jorking it, its that good .it as narration, lavish lifestyle, sharp suits and just amazing overall"
Lord of War,highest,i wouldve been a crazy weapons merchant
Lord of War,highest,"QUE INCREÍBLE PELICULAAAAAAAAAAla historia es asombrosa de inicio a fin, la intro es la mejor que he visto, el cast una belleza.Grande el its morbing time 🦇"
Lord of War,highest,"Посмотреть второй раз? НетОднако фильм прекрасный, с хорошим необычным сюжетом и очень сочными кадрами"
Lord of War,highest,"Letterboxd is an independent service created by a small team, and we rely mostly on the support of our members to maintain our site and apps. Please consider upgrading to aPro account—for less than a couple bucks a month, you’ll get cool additional features like all-time and annual stats pages (example), the ability to select (and filter by) your favorite streaming services, and no ads!"
Lord of War,highest,Cansei de negar que sou apaixonado no Nicolas Cage.
Lord of War,highest,Nicholas cage more concerned with AIDs than arming rebel militias
