film,review
Interstellar,sigh ya’ll were right about this movie.
Interstellar,There is nothing I dislike about this movie. I want a daughter.
Interstellar,zajtra pisem z kvantovej a cele moje ucenie bol tento film takze asi 1 nvm
Interstellar,“It was me Murph. I was your ghost.”just throw me in a black hole at this point
Interstellar,Duele demasiado el encuentro de Murph
Interstellar,ES UNA OBRA MAESTRA!ojala vuelvan a proyectarla en cines algún día pq merezco vivir está experiencia.
Interstellar,"Letterboxd is an independent service created by a small team, and we rely mostly on the support of our members to maintain our site and apps. Please consider upgrading to aPro account—for less than a couple bucks a month, you’ll get cool additional features like all-time and annual stats pages (example), the ability to select (and filter by) your favorite streaming services, and no ads!"
Interstellar,mrs grover putting me onto the good movies
Interstellar,"Jessica Chastain drops the most legendary line:""Hey dad... you son of a bitch.""Forget saving the world or time travel. The real drama is her dad vanishing for decades and then popping out of a 5D bookshelf. 10/10 moment."
Interstellar,"one of those movies where a mobile screen, or any screen that doesnt cover your entire field of view doesnt do this movie any justice. i'm so moved everytime i watch it"
Interstellar,ONE OF THE BEST SPACE FILM IDGAF
Interstellar,um filme que romantiza o abandono parental de um pai que vai comprar cigarro em plutão
Interstellar,"no doubt , the besttt ⭐️⭐️✨✨🥂🥂🤍🤍"
Interstellar,"Letterboxd is an independent service created by a small team, and we rely mostly on the support of our members to maintain our site and apps. Please consider upgrading to aPro account—for less than a couple bucks a month, you’ll get cool additional features like all-time and annual stats pages (example), the ability to select (and filter by) your favorite streaming services, and no ads!"
Interstellar,"Track 14 - Detach5:30, is the most beautiful thing I’ve ever heard"
Interstellar,Just finished watching it loved it too 5 very long but so so so good
Interstellar,Almost every single human I have personally met hates this movie.My family hated it. My wife hated it. My friends hated it. My in-laws hated it. Every random person I’ve ever talked to about movies? Hated it. I cannot think of any movie I’ve seen that is collectively disliked by so many I’ve met.And thenI see the high rating on Letterboxd. Wtaf? Is this a psy-op? Is big sci-fi lying about how good this movie is? Do…
Interstellar,"I find that I am often intrigued by this genre(?) of science-fiction realism where the mathematical and probable outcome is possible, if far-fetched. There is an entertaining display of thought-provoking ideas and concepts though I felt nothing more. The reliance on finding an answer to Cooper’s expedition could not pass through to resonate with my emotions and I desperatelywantedto care. For as lovely and beautiful as the visuals and soundtrack are, I would rather watch an episode of NOVA or visit a planetarium."
Interstellar,"Franchement ok le film est génial, il est beau, les thèmes abordés sont plutôt intéressantes mais faut ce l’avouer qu’au fur et à mesure du temps, les gens abusent du film comme quoi c’est meilleur film de toute la décennie alors que nan il y a plusieurs film qui sont bien meilleurs que Interstellar. Je dis pas que je n’aime pas et la preuve sur ma note mais stop c’est pas le film du siècle."
Interstellar,Honestly it's imperfect but it's a favorite for me... It just resonates
Interstellar,"Perfect, I've never seen a movie address quantum mechanics in such a faithful way, and despite all the scientific discussion it still has a ""simple"" meaning: love between father and daughter. I repeat, perfect movie."
Interstellar,"Never gets old, hoe vaak ik het ook zie"
Interstellar,This movie is so good I would give it a MILLION stars. The plot twist during the movie was crazy to me and I didn’t expect it at ALL. Honestly the soundtrack was amazing and the concept of space and wormholes was so cool. It was was also very very sad I cried while watching☹️ anyway I loved Murph btw she was so intelligent. Cooper and TARS were so funny. This movie also made me realize that time is truly just a concept and it really isn’t as long as we think. Overall so good
Interstellar,SOU APAIXONADA ESSE FILME É INCRÍVEL TIPO TODOS DEVERIAM ASSISTIR UMA VEZ NA VIDA PELO MENOS UM ABSURDO DE BOMMM
Interstellar,Second watch was exponentially better than the first.
The Dark Knight,So the man that freaked me out and had me at the edge of my seat is Patrick Verona!!?!??
The Dark Knight,"Heath Ledger’s performance is potentially one of the greatest of all time. Mix it in with great special effects, twists and turns, grit and action, and I think you might have a perfect movie."
The Dark Knight,"Truly a great movie. So well directed and the story is very good, too. The opening sequence is perhaps the best made heist in film history. Not as complex as an Ocean's 11 or Inside Man, but so perfectly executed, right down to the mask reference to The Killing."
The Dark Knight,"Look, if you had one shot or one opportunityTo seize everything you ever wanted in one momentWould you capture it or just let it slip?"
The Dark Knight,"Christopher Nolan’s The Dark Knight is a cinematic triumph that transcends the superhero genre. From its gripping narrative to its jaw-dropping performances, this film is a work of art that redefines the superhero movie.Christian Bale’s portrayal of Batman is as intense and layered as ever, but it is Heath Ledger’s iconic performance as the Joker that elevates this film to legendary status. His chilling, anarchic energy dominates every scene, creating one of the most memorable villains in movie history.…"
The Dark Knight,hate batman in this but every scene with joker heath ledger and maggie gyllenhaal saved it
The Dark Knight,Føler folk ikke snakker nok om Aaron Eckhart i denne filmenMannen spiser opp hver scene han er i jo
The Dark Knight,"heath ledger's performance as the joker is so phenomenal, i legit just could not look away."
The Dark Knight,"Letterboxd is an independent service created by a small team, and we rely mostly on the support of our members to maintain our site and apps. Please consider upgrading to aPro account—for less than a couple bucks a month, you’ll get cool additional features like all-time and annual stats pages (example), the ability to select (and filter by) your favorite streaming services, and no ads!"
The Dark Knight,"“Superhero movie” is probably one of my least favorite genres out there, to be honest. Was never really a fan of DC nor Marvel. The Guardians of the Galaxy trilogy is perhaps the only exception. Until now.The Dark Knight was fantastic. It unexpectedly surpassed my expectations, I was on the edge of my seat the whole time. I thought that Heath Ledger’s Joker was gonna be the only good thing this movie has to offer, but jesus, the whole movie was just so good."
The Dark Knight,28th April be with you happy superhero day the greatest superhero of all the time goatmanRagnar o batman 3mkom
The Dark Knight,"simplesmente uma obra prima. com diversas cenas memoráveis, o melhor vilão de todos os filmes e atuações perfeitas, esse filme se consagra como o melhor desse gênero de heróis. acho genial a origem do duas caras, nunca pensei que um vilão que antes eu considerava secundário poderia ser tão foda."
The Dark Knight,minus a half star because they missed the opportunity for the joker to say “you wanna know how i got these bars?” and engage in a rap battle with batman
The Dark Knight,"One of the best movies of the DC universe, Christopher Nolan is a genius."
The Dark Knight,forever one of my favourite films ever. a masterpiece in every way. rip heath ledger you king
The Dark Knight,scrr como pode um filme ser tão bom pqp
The Dark Knight,"não gosto da dc, mas que filme BOM extremamente BOM"
The Dark Knight,"No sé si sea porque debo volver a verla con otros ojos o si realmente no veo la misma película como todo el mundo, pero he visto a mucha gente hablar de esta película como la mejor de superhéroes jamás hecha, y debo de decir que si, es buena, obvio, pero por ejemplo the Batman se me hace mil veces mejor que esta. Para empezar lo mejor de la película sobra decir que es Heath Ledger como Joker seguido de…"
The Dark Knight,"Letterboxd is an independent service created by a small team, and we rely mostly on the support of our members to maintain our site and apps. Please consider upgrading to aPro account—for less than a couple bucks a month, you’ll get cool additional features like all-time and annual stats pages (example), the ability to select (and filter by) your favorite streaming services, and no ads!"
The Dark Knight,One of my favorite movies of all time so I am happy to finally review it on this app.It had been a few years since I had watched this movie in its entirety. I used to watch the joker scenes repeatedly on YouTube and I think that made me view the movie as more disconnected in the past. It was nice to watch it all again and see how “ahead of the curve” the joker was the entire time.…
The Dark Knight,How did harvey dent not know it was the joker until he took off his face mask
The Dark Knight,The Dark Knight as a complete film was not as incredible as Heath Ledger was by himself. The movie didn’t allow enough time for certain scenes to breathe and didn’t feel as complete as Batman Begins did. With that being said I have it on par with Batman Begins because Ledger’s joker was utter perfection.
The Dark Knight,best adaption of batman and the joker FIGHT ME
The Dark Knight,loveeee this one! amazing villains
The Dark Knight,I’d smash majority of the men in this except for harvey EW
Inception,"Did not fully understand what was going on when I first watched it in the cinema, but now I get it… what a great movie!"
Inception,"Finally I can partake in the discussion. I presume most enjoy Nolan’s passion with dimensions, time, and the space that he incorporates into his stories. That in my opinion is the most pure representation of his signature or fingerprint in a film. Personally what has accumulated to compel me to discuss Nolan in conversations and my personal headspace as a talented director is his visual effects with physics.Visually Inception is stunning. I am not a movie buff, but the creative…"
Inception,"Je n'ai pas compris, il s'agit donc d'un rêve dans un rêve, dans un rêve, dans un rêve, dans un rêve, dans un rêve, dans un rêve, dans un rêve, dans un rêve, dans un rêve, dans un rêve, dans un rêve, dans un rêve, dans un rêve, dans un rêve, dans un rêve, dans un rêve, dans un rêve, dans un rêve, dans un rêve, dans un rêve, dans un rêve, dans un rêve, dans un rêve et dans un rêve ? Sinon Super !"
Inception,what if we're all NPCs inside another person's dream
Inception,Gotta be one of my favorite movies
Inception,"oh good, now im scared leo dicaprio will manipulate me thru my dreams😨"
Inception,"Per molti un cult e forse lo è; l'incipit è notevolissimo e Nolan sa giostrarlo benone, grazie a un buon cast (bravo Di Caprio), ottima regia e perfetta gestione di effetti speciali ""vecchia scuola"". Di contro, la carne al fuoco è troppa e i bersagli vengono a mancare, soprattutto in un terzo atto troppo lungo e confusionario. Nel complesso, un prodotto di gran fattura, che merita il plauso di molti, ma i capolavori sono altri."
Inception,"stop right now. i was screaming “FALL FALL FALL BITCH FALL” at the end i’m not even kidding.i get that the point of the last scene is that cobb doesn’t care because he’s reunited with his children and thats all he wanted, but i can’t help feeling disappointed that if it really is a dream, cobb is okay with leaving his real children in reality and living with projections instead. that is why i choose to believe he's in reality, that he escaped the dream, and that he is with his real children at last."
Inception,when you need therapy but you’re a man
Inception,I don’t care about the dead wife I’m sorry
Inception,GOD DAMNIT WHAT WAS THE ENDING NOLAN U CRAZY FUCK I'MA FIND UUU.(And Cillian Murphy and then plant and idea to marry me) I MEAN WHAT
Inception,"Letterboxd is an independent service created by a small team, and we rely mostly on the support of our members to maintain our site and apps. Please consider upgrading to aPro account—for less than a couple bucks a month, you’ll get cool additional features like all-time and annual stats pages (example), the ability to select (and filter by) your favorite streaming services, and no ads!"
Inception,"il peut être franchement bien mais je m’endormais un peu donc j’ai pas tout compris, à revoir !"
Inception,"Letterboxd is an independent service created by a small team, and we rely mostly on the support of our members to maintain our site and apps. Please consider upgrading to aPro account—for less than a couple bucks a month, you’ll get cool additional features like all-time and annual stats pages (example), the ability to select (and filter by) your favorite streaming services, and no ads!"
Inception,Ce film est un test de QI d'une durée de 2 heures
Inception,Joseph Gordon Levitt doing a little Troy Bolton I see
Inception,"I started this on december last year and was so close to the ending..i don’t understand why I didn’t finish this, it’s so good."
Inception,Sad I can’t use saying that I’ve never seen this as a party trick anymore
Inception,Oh my god i just watched this properly and holy fuck. saw hans zimmer play 'time' last night in sydney and the tears are flowing
Inception,"Nunca tuve la oportunidad de ver la película completa hasta hace unos días.Y genuinamente me surge una pregunta ¿De de verdad la gente creía que era una película súper compleja?Primero quiero aclarar que la película es increíblemente buena; una película de atracos en dónde no se roba nada, sino que se implanta una idea dentro del inconsciente de la persona, entrando en su sueñom El equivalente a irrumpir en un banco para dejar dinero.Esa es una premisa…"
Inception,"""in my dreams we're still together"""
Inception,Flemme de comprendre le scénario mais c’était banger
Inception,"Une masterclass du cinéma, du grand art à tout les niveaux"
Inception,"Bir fikir, virüs gibidir. Esnektir. Oldukça bulaşıcıdır. Ve ufacık bir fikir tohumu bile büyüyebilir. Seni tanımlamak, ya da yok etmek için büyüyebilir.Benim adım Nolan, zamanla problemim var!"
Inception,The complexity of this movie is crazy
Lord of War,"It’s true, a gun never killed anybody.… we should blame the individual that aimed and pulled the trigger.It’s also true that without constant death, the market for guns would be obsolete.thoughts and prayersdon’t mean anything when the industry continues to arm evil individuals, and financially corrupt politicians. At bare minimum they’re  enabling killing."
Lord of War,"Eeehh mais ou menos, mais ou menos,realmente bem+/-, não me entendam mal o filme é bacaninha mas oNicolas Cage não convencecomo um vendedor de armas principalmente no começo que ele aparentemente tem 20 anos mas tem a cara mais velha que a do pai dele????E o outra, o filme parece correr com a historiapelo menos até na metade, que aí a trama começa a ficar legal,por que finalmente começa a ser desenvolvida!Por…"
Lord of War,my beloved ethan hawke is goated
Lord of War,The pacing was a little off and a lot of the dialogue felt stunted but overall good movie. Having Cage be an unreliable narrator was a very good move. Ending felt rushed (probably not intentional) and dissatisfying (definitely intentional). It especially stings since the real guy Cage’s character is based on got released in a prisoner swap for WNBA legend Brittney Griner. At least Jared Leto died in it.
Lord of War,very prototypical 2000s stimmy realistic fiction movie
Lord of War,"This movie was so uninteresting to me that i got halfway through before i realized i had already watched it a few years ago. the movie is so blandly nihilistic that it can't even fully commit to its own brand of self-important nihilism. felt like trying to chew through cardboard. half a star because some of the individual scenes character moments were, i guess, creative."
Lord of War,Thought this was a bio pic at first so that made it super cool and much more tense. A little cliche at times but alas cause it rules
Lord of War,I noticed that some of the characters Donny seem to age over 20 years.
Lord of War,Me sentí un señor divorciado que paga 3 pensiones alimenticias y que solo toma alcohol al ver esta película
Lord of War,Got to be the most unrealistic family ever
Lord of War,"Unique plot, amazing narrator and good way to weave a political message into your story. ⭐️⭐️⭐️"
Lord of War,i wouldve been a crazy weapons merchant
Lord of War,A movie I liked more than I thought I would. It’s a movie about Yuri’s descent into dehumanization before he regains a consciousness of sorts and feels the gravity of the situation he put himself within. A film that captivated me from start to finish; I found that I was more invested in Yuri’s character growth and what would happen to him than a lot of other characters in a moral grey realm like him. It’s a fantastically real story…
Lord of War,"too many one liners to choose from, fuck ethan hawke little nerd"
Lord of War,"A very Scorsese-esque movie here and one that I actually liked at that: maybe a little too reverent at times, but I use that comparison favourably for the most part; Nic Cage also puts in one of his more understated and as a result, better performances here aswell and writer-director Andrew Niccol spins a brilliant cautionary tale on the weapons trade despite how some of his characters (though developed fairly well) might only serve as a mouthpiece for his message in this movie. As a whole, however, it's good, solid filmmaking with a noble story to tell."
Lord of War,"Great editing and camera work, underwhelming narrative.The film stuffs so much plot in it’s 122 minute runtime that there is no room to for proper characterization and theme development. Both aspects of the film remain flat and cartoonish.Juri’s wife is an idealized princess straight out of a disney film. His brother is a one trick pony who’s constantly coked out and horny, until the plot forces him to become a martyr. Juri‘s parents are props, used to verbalize…"
Lord of War,"i could tell you the plot from the first 5 minutes, but dtill good"
Lord of War,One of my comfort movies I think? First time seeing it on the 4K disc.
Lord of War,Jormungand diye bi anime var baya benziyor
Lord of War,"Letterboxd is an independent service created by a small team, and we rely mostly on the support of our members to maintain our site and apps. Please consider upgrading to aPro account—for less than a couple bucks a month, you’ll get cool additional features like all-time and annual stats pages (example), the ability to select (and filter by) your favorite streaming services, and no ads!"
Lord of War,"Nicolas Cage walked as the ""Lord of War"" so Jonah Hill could run in ""War Dogs"""
Lord of War,uma das cenas de introdução mais icônicas do cinema modernoHow do we arm the other 11?
Lord of War,"História meio clássico sobre crime, acha impressionante mas deve ser o terceiro ou segundo filme q vejo o jared leto interpretando um drogado"
Lord of War,"Great and though provoking movie about asshole. This film is what i call dark comedy. First you laugh, but later you're sad when you realize all the disturbing facts behind the jokes."
Lord of War,filme de açao completo dubladonem tanto mas massa
The Zone of Interest,"Fascism is a sickness brought on by pathetic men that use power to fuel their pathetic lack of self worth. Rampant propaganda and dogma distract the masses and inoculate them to the violent horrors inherent to fascists. To this family the horrors that echo from the Auschwitz death is a part of their routine, a regular feature in their neighborhood ambiance. Any screams are from the subhumans.Nazis aren’t some otherworldly creatures that came down and just decided to do…"
The Zone of Interest,chillingly uncomfortable watch. boring but needed to be.
The Zone of Interest,"Letterboxd is an independent service created by a small team, and we rely mostly on the support of our members to maintain our site and apps. Please consider upgrading to aPro account—for less than a couple bucks a month, you’ll get cool additional features like all-time and annual stats pages (example), the ability to select (and filter by) your favorite streaming services, and no ads!"
The Zone of Interest,"This is not grim enough for a movie about the holocaust, yet it is so very grim. Felt like a horror movie about a real life monster"
The Zone of Interest,Shows the horrors in a “normal” family setting. What was even most unsettling was watching this movie after being to Auschwitz and seeing the horrors committed and where Höss’s house would’ve been and knowing he would’ve seen the atrocities. Insane but very well made
The Zone of Interest,extremely effective film. trusting that the audience can keep up. i've seen people call it 'horrific in its mundanity' since it premiered and. yep.
The Zone of Interest,anche meno peròfilm pseudo intellettuale del cazzo
The Zone of Interest,‘everything we want on our doorstep’what a mass genocide???
The Zone of Interest,i dont know how to describe this. i really dont. the emotions i have felt i never felt before. it has horrifying but knowing it is the reality is way more terrifying than the actual thing
The Zone of Interest,"Lo que más me impresionó fue que la familia jamás hizo mención de los campos de concentración, mostrando que lo han normalizado hasta tal punto que no es algo más que ‘si, ahí lado hay un genocidio’. Muy buena fotografía, algunas tomas me tomaron por sorpresa por la belleza que mostraban en pantalla pero al fondo escuchando los gritos y sufrimientos de los judíos…"
The Zone of Interest,I will watch Sandra Hüller in anything.
The Zone of Interest,"Dificilmente um filme me deixa perturbada, esse me deixou. Muito bom."
The Zone of Interest,"One of the best films of 2023 and fully deserving of its nomination for Best Picture and its wins for Best International and Best Sound in particular. No movie has made me feel so abhorred for its subjects for their apathy and disregard for human life. Though you never see their victims, they were real people, just like you and I, and the choice of the film makers to never portray them in the film is a reflection of the…"
The Zone of Interest,"Chilling, suffocating, and brutally restrained — The Zone of Interest is a masterclass in showing horror without showing it. Glazer’s detached, almost clinical approach makes the evil feel even more monstrous, embedding it into the everyday rhythms of a ""normal"" life. The sound design does half the heavy lifting, and it’s terrifying in ways that visuals could never achieve. Christian Friedel and Sandra Hüller are hauntingly ordinary, which is exactly the point. It’s not an easy watch, but it’s essential, and it lingers long after the credits roll like a sickness you can’t shake."
The Zone of Interest,this dude used to makesexy beastso i feel like that tells you something about howyou’remeant to be feeling walking around every day
The Zone of Interest,"this is a horror movie. And I completely get why they gave it the Best Sound Academy Award, sounds in the movie are so crucial and so disturbing that makes you focus that we are thinking about what's on the orher side of the wall. Its one of the best movies I've seen, and its as terrifying and horrible as its majestic. Pretty relevant to see how there are other zones of interest in the present day."
The Zone of Interest,"c’est la preuve qu’on peut raconter des choses atroces sans les montrer, et qu’un très bon film c’est pas juste des belles images, c’est de la musique, du sound design, un voyage auditif (traumatisant)"
The Zone of Interest,"So deep into war movies, I might never return 🧠🪖🐈‍⬛"
The Zone of Interest,"""Denn wir alle leben in einer Welt, auf der tagtäglich so viel Leid, Schrecken und Gräueltaten geschehen. Durch das Internet können wir an fast allen Geschehnissen dieser Welt, allen Kriegen und sämtlichem Unrecht beinahe in Echtzeit teilhaben. Es geschieht beinahe direkt neben unserem Garten. In Hör- und Sichtweite. Nur getrennt von einer grossen Betonmauer. Und doch entscheiden wir uns so oft für den schönen Kindergeburtstag mit lachenden Kindern in unserem Garten. Entscheiden wir uns dafür, wegzusehen, obwohl die Betonmauer uns…"
The Zone of Interest,"Le message derrière ce film est saisissant et donne froid dans le dos. De plus ce message est sublimé par une caméra absolument magnifique.Je pense sincèrement que ce film doit être vu par le plus grand nombre de personne ne serait-ce que pour le message véhiculé .Cependant, je suis conscient que certaines personnes pourront s’ennuyer devant."
The Zone of Interest,"Did not think I’d find the basic day to day of an SS family interesting but here we are. Just amazing sound and cinematography never showing the horrors of the concentration camps was a great choice just showing how terrible this place was, but without seeing anything but knowing all this terrible things are happening."
