film,sort_type,review
Fight Club,lowest,"this movie absolutely sucks. its dumb childish and the twist, so expected i could see it coming from a mile ahead. the MC sucks cuz i have insomnia and its nothing like how they portray it. david fincher also sucks the only good thing abt this movie is brad pitt absolute daddy material"
Fight Club,highest,What the fuck is this masterpiece
Fight Club,highest,I’m not even fucking with you bitches this shit made me have like seven fucking mental breakdown but also seeing Jared Leto get beaten was really fun over all really fucking good and I get the hype
Fight Club,highest,"ONE OF THE BEST MOVIE EVERThis film start with confusing,wondering and then it made my heart warming with their friendships and then I mesmerized how he form this club and my heart is breaking again when tyler  gone and it’s super confusing and at the end I feel so full and so loved I literally love how this movie make me feel everything it’s like being in another world and it’s so real I can’t do anything for three hours cause this movie it’s spelled on me I’m mesmerized and it becomes part of me (sorry for bad English)"
Fight Club,highest,"Letterboxd is an independent service created by a small team, and we rely mostly on the support of our members to maintain our site and apps. Please consider upgrading to aPro account—for less than a couple bucks a month, you’ll get cool additional features like all-time and annual stats pages (example), the ability to select (and filter by) your favorite streaming services, and no ads!"
Fight Club,highest,"Letterboxd is an independent service created by a small team, and we rely mostly on the support of our members to maintain our site and apps. Please consider upgrading to aPro account—for less than a couple bucks a month, you’ll get cool additional features like all-time and annual stats pages (example), the ability to select (and filter by) your favorite streaming services, and no ads!"
Fight Club,highest,"Letterboxd is an independent service created by a small team, and we rely mostly on the support of our members to maintain our site and apps. Please consider upgrading to aPro account—for less than a couple bucks a month, you’ll get cool additional features like all-time and annual stats pages (example), the ability to select (and filter by) your favorite streaming services, and no ads!"
Fight Club,highest,One of my favorite movies and I’m tyler durden
Fight Club,highest,"Don’t worry, I’m not gonna talk about it."
Fight Club,highest,ยอด ดีเลิศ เด็ดขาด อันดับหนึ่ง ศักดิ์สิทธิ์ มหัศจรรย์ ที่สุด ชนะเลิศ เลิศเลอ ดีเด่น สุดเหวี่ยง
Fight Club,highest,I WATCH IT AGAIN MORE IN LOVEEE DUHHH IM Breaking the first rule
Fight Club,highest,"“I feel like destroying something beautiful”It’s perfect. It’s unreal, surreal, and just so fucking real at the same time. It’s spotless. If I could do it all over again, I would’ve gone into this movie knowing even less than what I did. One of the rare films I’ve heard so much buzz about that actually exceed the expectations. Thank goodness for Edward Norton and oh my god thank god for the gene pools that created Brad Pitt."
Fight Club,highest,You met me at a very strange time in my life (i’m on my period)
Fight Club,highest,Remind me of you ss4 so much the plot twist actually really shock bc the movie be giving out clues and i still have no idea what that meant great watching tho i get it why this is famous and oh lord oh my lord brad pitt is genuinely hot
Fight Club,highest,you met me at a very strange time in my life
Fight Club,highest,I love David fincher I’m so in love with his movies his styles and this movie it killed for the first time I watched I love how the character became and it was running and running and it squeezed itself LUV DIS SM and also cinematography it all killed me fafafafafadafafadafffafafsfaf
John Wick,lowest,Is it paying homage or is it just another movie that AI can soon make for us.
John Wick,lowest,I fell asleep during every john wick ive watched (all of them)
John Wick,lowest,"Don't know why I did it to myself I know he's not a good actor, Willem should be embarrassed he's in this"
John Wick,lowest,boyfriend made me watch this and i hated everything about it
John Wick,lowest,"It's so ASS??? Overhyped for NOTHING, it's just a guy fighting and killing random the whole time like"
John Wick,lowest,dumbest movie i’ve ever watched wtf there’s like no plot why is this so popular
John Wick,lowest,does anybody wanna come home with me and watch smack dvd?
John Wick,lowest,Hated it. Single handedly started the male loneliness epidemic.
John Wick,lowest,"Somehow amongst all this contrived BS, the most unrealistic part was the puppy knowing to do his business outside"
John Wick,lowest,not a fan of action brainrot movies at all.
John Wick,lowest,“Dali jena mu e murtva”“Moje bi ne se e rodila oshte”Dimi
John Wick,lowest,Um bom filme de ação é outra coisa… este é apenas um amontoado de cenas de violência gratuita
John Wick,lowest,I don’t like human necks turning 360 degrees.
John Wick,lowest,"Letterboxd is an independent service created by a small team, and we rely mostly on the support of our members to maintain our site and apps. Please consider upgrading to aPro account—for less than a couple bucks a month, you’ll get cool additional features like all-time and annual stats pages (example), the ability to select (and filter by) your favorite streaming services, and no ads!"
John Wick,lowest,"I started bawling my eyes out when the russian guy killed the puppy, which fucking writer thought of that???? i’d give minus stars if possible, i couldn’t focus on anything else in this goddamn movie"
John Wick,highest,"Meu sonho é ser uma assassina de elite, igualzinha ao Jon Wick"
John Wick,highest,Um revolucionário dos filmes de ação
John Wick,highest,I can't believe this movie is 11 years old. It's still awesome.
John Wick,highest,hay gente que jamás va a entender la maldita vibra como la entendió keanu reeves al aceptar este rol
John Wick,highest,"Those who cling to death, live and those who cling to life, die.The boogeyman.It was just a fuckin car..just a fucking dogHuh just a dog, viggo, when helen died i lost everything until that dog arrived at my doorstep. A final gift from my wife. In that moment, I recieved some semblance of hope, an oppurtunity to grief unalone. And your son took that from me, stole that from me, killed that from me!!People Keep Asking…"
John Wick,highest,"Letterboxd is an independent service created by a small team, and we rely mostly on the support of our members to maintain our site and apps. Please consider upgrading to aPro account—for less than a couple bucks a month, you’ll get cool additional features like all-time and annual stats pages (example), the ability to select (and filter by) your favorite streaming services, and no ads!"
John Wick,highest,Voilà faut pas tuer les animaux
John Wick,highest,"Until it was shown to me, I obviously had never seen the film before. I was able to guess why John Wick was going to do whatever he ended up doing in the movie within ten minutes. My friend was shocked, pausing the movie and asking if I had seen it beforehand. I had not. However, being on point about the beginning and rest of the movie shocked me. Maybe I've seen too many films? Regardless, I got a chuckle from the guessing experience.Loved the movie, would watch again."
John Wick,highest,"Letterboxd is an independent service created by a small team, and we rely mostly on the support of our members to maintain our site and apps. Please consider upgrading to aPro account—for less than a couple bucks a month, you’ll get cool additional features like all-time and annual stats pages (example), the ability to select (and filter by) your favorite streaming services, and no ads!"
John Wick,highest,Watched half of it years ago and got bored. Caught the second half on movie hub just now. hell yeah.
John Wick,highest,eu amo o John Wickpelo amor de deus é muito foda que TODO MUNDO conhece o John e todo mundo teme ele e ja se treme so de ouvir o nome 😭😭esse cara é foda
John Wick,highest,"One of the most stylish action films ever made. Keanu Reeves brings pure intensity to his role, and the fight choreography is unmatched. The world-building and visual aesthetics are top-notch, and the soundtrack just elevates the entire experience. The best part? It’s a non-stop thrill ride from start to finish. 11/10"
John Wick,highest,considered joining the high table
John Wick,highest,Hated that dude in game of thrones and hated him just as much in this film.
John Wick,highest,"Uma história de vingança daquelas que te prendem na tela, John vivia a paz de uma aposentaria , porém vivendo os traumas da viúves precoce, até ter um encontro com os futuros mortos, e cometeram o erro de matar o seu cachorro.Filme quase poético em sua construção, ótimas cenas de ação."
The Matrix,lowest,"Didnt understand this film, when i was watching it i felt my brain fart. Only reason why i watched it was cos i heard du hast played in it"
The Matrix,lowest,efe dayanır taşaklarıma tekme attı film yüzünden
The Matrix,lowest,Created the worse type of people known on this planet
The Matrix,lowest,"😭 Je suis vraiment désolée. Qu’est ce que c’était mauvais je m’y attendais pas. Ok pour l’allégorie pour la transidentité et tout puis ce que je me sens concernée mais les dialogues sont nuls, les acteurs sont horribles surtout leurs manières de réagir. L’action est pas terrible sans oublier les horribles scènes en ralenti, il ne manquait plus que l’utilisation de la musique à outrance.Ce film constitue à peu près tout ce que je déteste voir dans le cinéma. Toute fois, Je comprends les gens qui aiment le film mais moi je peux pas."
The Matrix,lowest,"El peor universo, los peores diálogos, el peor argumento firme"
The Matrix,lowest,all the boys might kill me for this.it soo boring.sorry to the boys out there
The Matrix,lowest,this movie too freaky why is there things crawling out of peoples belly buttons
The Matrix,lowest,Got 30 minutes in and gave upToo much brainpower needed
The Matrix,lowest,"God I hate this movie. It’s painfully bad in its effects (just go with practical effects. They’ll always look better. Like seriously), and the message comes off as just a They Live ripoff. I watched The Matrix once a couple years ago, and never intend on seeing it again."
The Matrix,lowest,no entendí anda y me pareció aburrida
The Matrix,lowest,"Letterboxd is an independent service created by a small team, and we rely mostly on the support of our members to maintain our site and apps. Please consider upgrading to aPro account—for less than a couple bucks a month, you’ll get cool additional features like all-time and annual stats pages (example), the ability to select (and filter by) your favorite streaming services, and no ads!"
The Matrix,lowest,Only watching for Keanu and even that wasn't enough
The Matrix,lowest,"hbo dr sanaandgu uzchiv. joohndo yag ter agentuudad barigddg hesgiign uzej bsn. did she know in a future i’d watch this film again, wouldve she known that we will be sitting side by side."
The Matrix,lowest,I fell asleep cause it's so boring.
The Matrix,lowest,"Letterboxd is an independent service created by a small team, and we rely mostly on the support of our members to maintain our site and apps. Please consider upgrading to aPro account—for less than a couple bucks a month, you’ll get cool additional features like all-time and annual stats pages (example), the ability to select (and filter by) your favorite streaming services, and no ads!"
The Matrix,highest,Nan Mateix c’est vraiment chaud !
The Matrix,highest,No podía parar de pensar si alguna vez se bañabanI'm sorry
The Matrix,highest,Watched it on a flight and when Neo got the parasite sucked out his stomach he shouted Jeepers Creeprs!
The Matrix,highest,"They say no one can be told what the Matrix is. You have to see it for yourself..I would argue that had I been blind, my comprehension via braille would've been equally sufficient to grok the narrative's demands, more so than my initial viewing that included all of my senses, including smell."
The Matrix,highest,This is weird but it's my comfort movie lol.
The Matrix,highest,all you gotta do is believe in yourself and maybe get a really hot girl to kiss you
The Matrix,highest,1000000/10 for the movie and 1000000/10 for Keanu’s beautiful god-made face
The Matrix,highest,"¿Qué es real y qué no? ¿Acaso el ""mundo"" es tal y como lo vemos o es solo una ilusión? Esta es la gran interrogativa que nos plantea Matrix, una de las películas de ciencia ficción más influyentes de todos los tiempos. Más allá de ser una obra de ficción, también la considero un ""ensayo"" filosófico y reflexivo sobre el futuro de la humanidad y el uso de la tecnología, con toques existencialistas sobre el destino y nuestra percepción de…"
The Matrix,highest,this movie is the best thing that ever happened to me this year
The Matrix,highest,I think this must be my first time watching since knowing Lana & Lilly Wachowski are trans because the trans agenda™ really hit me this time!! incredible
The Matrix,highest,prepping for my birthday party yes maam
The Matrix,highest,My love letter to leather dykes n Sydney.
The Matrix,highest,"Excellent movie, covers certain philosophical topics insightfully"
The Matrix,highest,"Letterboxd is an independent service created by a small team, and we rely mostly on the support of our members to maintain our site and apps. Please consider upgrading to aPro account—for less than a couple bucks a month, you’ll get cool additional features like all-time and annual stats pages (example), the ability to select (and filter by) your favorite streaming services, and no ads!"
The Matrix,highest,As a transwoman I am legally obliged to give this movie a 5 star rating
11 Rebels,lowest,bit overdramatic but ok for action freaks
11 Rebels,lowest,"I just saw and reviewed director Kazuya Shiraishi’s previous movieBushidoa few days ago, which I didn’t love but thought showed a lot of promise. So I was looking forward to his next period film,Eleven Rebels, which opened today. The story combines aDirty Dozen-style “men on a mission” movie with a “small group of heroes makes a last stand against a more powerful enemy” movie. I love both of these elements, and furthermore the inclusion of a number…"
11 Rebels,lowest,"In11 Rebels, the director deftly transitions from the lone warrior trope to a richly textured ensemble narrative, plunging viewers into the moral erosion of an avaricious aristocracy. Breaking from the customary samurai focus on honor, seen in films likeYojimbo, this film assembles an unlikely group of misfits on a doomed mission, delving deep into redemption and the possibility of societal reform.The film marries classic samurai swordplay with modern techniques, echoingSanjurobut with an intensified focus on teamwork.…"
11 Rebels,lowest,2h version.Original title:十一人の賊軍
11 Rebels,lowest,"Not sure how to rate this as I watched the shorter North American version which didn't really work overly well for me. Character development seems really lacking and even the plot became surface level. But I can understand why this cut would be created for an audience that is probably generally more interested in action, fights and gore and less about the politics and characters. For me it just became too confusing without that depth. And because we didn't get…"
11 Rebels,lowest,Thoguth this would be a clownery show by 11 but eventually turned into insane action with top notch strategies !
11 Rebels,lowest,It is a little bit too long but it had some pretty good moments and it is representing a group of individuals that is more deserving of recognition. The writing is good and the ending is quite okay.
11 Rebels,lowest,13 Assassins sin huevos (y guión).
11 Rebels,lowest,每年金馬都有這種cosplay日本片啊，不管拍哪個年代都還是像現代，大聲喊叫的單調演繹。唯一值得提及的一幕是雨水從武士眼簾落下的畫面，幾乎像是兩條線一樣的下墜，很好的靈感激發。
11 Rebels,lowest,"I mean it was alright, had a few decent characters but the rest were pretty insufferable, had the odd cool fight but didn't really care about any of the stakes at all"
11 Rebels,lowest,導演白石和彌2024年新作，第37屆東京電影節開幕片，電影以戊辰戰爭為背景，描述了一群罪人接受幕府的命令執行決死任務的故事。電影長度偏長，演員的台詞也聽不清楚，動作場面大多在昏暗場景，很多人討論的血腥場面也不怎麼樣，言過其實。白石和彌監督の2024年新作で、第37回東京国際映画祭のオープニング作品。戊辰戦争を舞台に、幕府の命令で罪人たちが決死の任務に挑む物語。尺が長く、セリフも聞き取りづらい。アクションシーンは暗くて見づらく、話題の残酷描写も大したことなく、大げさに感じた。
11 Rebels,lowest,"Suicide Squad on a budget, entertaining enough, but I’ve seen this story done better elsewhere"
11 Rebels,lowest,"It's like ""Dirty Dozen"", ""Suicide Squad"" or ""Rogue One"", but set in 1869 Japan.It's a bit too long but the ection sequences are good, the characters also and the story is interesting."
11 Rebels,lowest,"Do yourself a favour if you haven't seen them already and go watch 13 Assassins, Harakiri, the original 47 Ronin or any Kurosawa samurai movie. If you've already seen them just watch them again and save yourself from this insufferable mess."
11 Rebels,lowest,"Japan zur Zeit des Boshin Krieges um 1868. Samurai der kaiserlichen Armee kämpfen gegen eine Gruppe Banditen.Um Zeit zu gewinnen, werden Letztere nämlich, eine bunt zusammengewürfelte Gruppe aus Samurai und Kriminellen, 11 an der Zahl, zu einem Fort geschickt. Man gibt den Charakteren natürlich ein Stück weit Hintergrundgeschichten, wie beispielsweise eine Rachestory des Hauptcharakters, der eigentlich hingerichtet werden sollte, weil er den Vergewaltiger seiner Frau tötete. Einer unter den Rebellen führt wiederum einen Verrat im Schilde etc.Visuell ist…"
11 Rebels,highest,"A tad too disjointed to be great, but totally enjoyable on its own terms. Requires the buy in that yes roughly 11 rebels are going to come together to make a stand, leading to story beats familiar to anyone who has seen a (samurai) team-up movie. It shouldn't be a surprise to anyone that the old man in the bunch is moderately wise and wildly lethal, for instance, but I've got minimal complaints here because it's fun to see the…"
11 Rebels,highest,"So. Yeh. Pretty epic. Didn't mind it at all, just think unnecessary repetition added too many mins.A long way to go, for that bittersweet ending.Still trying to formulate thoughts, butt both butt & brain are slightly numb..."
11 Rebels,highest,"Brabo, Toei fazendo Jidai Geki no mais ambicioso possível."
11 Rebels,highest,"A wild piece of Japanese cinema, a load of fun. Then deeply moving.It has the most incredible final act."
11 Rebels,highest,"7 Samurai, 13 Assassins, 11 Rebels. What an awesome Trilogy."
11 Rebels,highest,"Um épico que passou despercebido ano passado, e que filme f#da!!!Durante a guerra do Boshin, um pequeno domínio leal ao shogunato precisa proteger um castelo importante do exército imperial, e para essa missão suicida reúne 11 criminosos e alguns soldados para protegê-lo, em paralelo uma conspiração se articula.Só pelo título eu pensei que se tratava de um remake do filmeOs Onze Samurais(1967) doEiichi Kudo, mas não é o caso, e ainda bem que eu estava…"
11 Rebels,highest,"Buena historia y muy bien filmada ,pero aún siendo muy entretenida peca de excesivo metraje ,dos horas y media se acaban haciendo largas ,pero cumple más que bien"
11 Rebels,highest,"Strong storytelling, funny and bloody, and enough depth to keep you going."
11 Rebels,highest,"These are all brought up along with a lot of awesome sword fighting and a lot of blood. If you are a fan of films like 13 assassins you'll enjoy this.👌🎥11 Rebelshas almost just the right balance of spectacular in your face swordplay, a revenge-fueled mega drams and double-crossing political mysteries🖤The movie is based on a script that had been shelved for 60 years.The movie is action packed, and has been described as a ""blood-drenched take…"
11 Rebels,highest,It's all over the place but the final arc is the best part.
11 Rebels,highest,"The real suicide squad. In this film the choice on how and why you want to die is brought to the for front. For love, country, brotherhood, a promise, revenge. These are all brought up along with a lot of awesome sword fighting and a lot of blood. If you are a fan of films like 13 assassins you’ll enjoy this."
11 Rebels,highest,"If it keeps Kurosawa’s flame alive... I’m all in.The gruesome action is impressively executed, with solid performances across the board. The soundtrack is beautiful, enhancing the film's atmosphere. While the story can be a bit confusing at times and runs a little long, it still manages to keep me engaged.A very pleasant surprise!Note: If Daisuke Tsuji is not available, I'm ready forTaiga Nakanoto take the role ofJin Sakaiin a futureGhost of Tsushimamovie."
11 Rebels,highest,"Gripping action packed period piece with 2-3 characteristics of characters You will not notice how fast those 2,5 hours fly by .Yes it is Netflix but it is still ok to check out."
11 Rebels,highest,Such a great film. Didn't expect it to be this good. So many twists and really good fight scenes with a great storyline and of course some gorgeous Japanese ladies
11 Rebels,highest,Thought I'd kill a Sunday evening but ended up loving the story. With a higher budget it would have been great.
Top Gun,lowest,this movie did not take my breath away. i don’t like tom cruise. sorry val kilmer.
Top Gun,lowest,Boomers really watched a recruiting ad with a soundtrack and mistook it for cinema
Top Gun,lowest,just Delete the movie atp bro absolute nothingburger
Top Gun,lowest,"Slow boring Navy recruitment ad. Do you want to watch 20 minutes of fighter plane b-roll followed by Tom Cruise trying awkwardly to hit on someone, well this is the movie for you. Every scene is at least 2x too long and mumbled.Tom Cruise is a weird combination of creepy and smug at all times. Val Kilmer is trying to make something work, but the premise and script is just a stinker.Also I just straight hate the character…"
Top Gun,lowest,"I just dont like this movie, or the sequel."
Top Gun,lowest,"Letterboxd is an independent service created by a small team, and we rely mostly on the support of our members to maintain our site and apps. Please consider upgrading to aPro account—for less than a couple bucks a month, you’ll get cool additional features like all-time and annual stats pages (example), the ability to select (and filter by) your favorite streaming services, and no ads!"
Top Gun,lowest,I’d rather scrape dog shit off a pavement covered in piss with my teeth than watch this again
Top Gun,lowest,the absurd jingoism just made this film feel like one whole self-parody...very clear this was released at the height of the cold war cause it just reeks of desperation 😭 also the homoeroticism was so underwhelming like everyone was lying bye
Top Gun,lowest,Un classique à voir mais sans plus. La relation amoureuse est purement intéressée. On suit le quotidien des pilotes mais on a très peu d informations sur les missions. Le 2 est bien plus développé au niveau des missions et des personnages. Peu de musiques mais comme j ai dit ça reste un film à voir.Regardez le 1 avant le 2 quand meme et surtout regardez le 2 qui lui est incroyable.
Top Gun,lowest,"Letterboxd is an independent service created by a small team, and we rely mostly on the support of our members to maintain our site and apps. Please consider upgrading to aPro account—for less than a couple bucks a month, you’ll get cool additional features like all-time and annual stats pages (example), the ability to select (and filter by) your favorite streaming services, and no ads!"
Top Gun,lowest,one time i watched this the highest and most scared ive ever been in my whole life. gay woman hating sausage fest btw
Top Gun,lowest,these type of men are the reason why i hate men
Top Gun,lowest,So dumb not even F-14s could make it fun
Top Gun,lowest,I’d recommend this just about as much as I’d recommend getting kicked in the balls
Top Gun,lowest,Gay dudes have such low standards
Top Gun,highest,"Letterboxd is an independent service created by a small team, and we rely mostly on the support of our members to maintain our site and apps. Please consider upgrading to aPro account—for less than a couple bucks a month, you’ll get cool additional features like all-time and annual stats pages (example), the ability to select (and filter by) your favorite streaming services, and no ads!"
Top Gun,highest,"Es una historia completa, de amor y amistad. Básicamente me hizo llorar, mi favorita junto con la segunda. Un poco triste a decir verdad"
